username,Label,text,date,bot
ila_rizky,Positif,khawatir ptm batas awas ketat camat sesuai epidemilog tular potensi camat prokes,12/4/2021,0
nursa1dr_,Positif,obrol lanjut temen gimana ptm buka kemaren isu klaster sekolah ngikutin berita prokes,12/4/2021,0
Ioverofjay,Negatif,bener abis ptm tepar abis pulsek ofline abis pulsek main mana tepar,12/4/2021,0
kxelabu,Positif,yok dukung cepat vaksinasi murid murid ikut ptm batas aman semangat vaksin tenaga didik,12/4/2021,0
radarmasnetwork,Positif,antisipasi klaster ptm,12/4/2021,0
notvenan,Positif,untung ptm cek buku tulis,12/4/2021,0
wenjaemsa_rvniz,Positif,putri selesai ptm,12/4/2021,0
jiiunssi,Negatif,takut ptm,12/4/2021,0
marklucuu,Negatif,males besok ptm sedih,12/4/2021,0
skygurlxz,Positif,ptm,12/4/2021,0
jeongminpdf,Positif,nga baik komunikasi kaya ptm ngobrol temen lost contact gara gara pandemi,12/4/2021,0
AdindaDara76,Positif,program vaksinasi tenaga didik cepat ptm batas vaksinasi guru ajar aman vaksin tenaga didik,12/4/2021,0
underooslokfy,Positif,ptm neng,12/4/2021,0
markleeterus,Negatif,sumpah males ptm,12/4/2021,0
Little_Shovya,Positif,angka ptm batas loh data tsb lapor sekolah warga sekolah tular covid infeksi klaster ptm batas lupa prokes,12/4/2021,0
nadia68443542,Positif,dukung vaksinasi guru sedih liat adik sekolah rumah moga aman sekolah ptm aman vaksin tenaga didik,12/4/2021,0
Boyhensem10,Positif,program vaksinasi tenaga didik cepat ptm batas cepat vaksinasi guru vaksin tenaga didik,12/4/2021,0
AndienNieta,Positif,sekolah laksana sekolah muka cepat herd imunity normal mari dukung ptm vaksin tenaga didik,12/4/2021,0
markflurryoreo,Negatif,aduh besok ptm hue padahal libur sjkabsknaljskx,12/4/2021,0
duniazie,Positif,informasi sekolah boleh ptm batas sekolah level pkm ajar tenaga didik vaksinasi inshalah prokes realisasi,12/4/2021,0
RiskaNgilan,Positif,ptm nilai anak anak ajar optimal konsentrasi ajar sehinga tertingal kanya prokes,12/4/2021,0
vtseongmin,Negatif,ptm males,12/4/2021,0
markyoujae,Positif,ptm sempet ptm keburu diberhentin alah sabar,12/4/2021,0
jeongmiese,Positif,ptm semangat,12/4/2021,0
Iixiest,Negatif,males besok ptm,12/4/2021,0
hwaruniez,Negatif,semangat sumpah ptm apan,12/4/2021,0
LaNyallaAcademy,Negatif,siswa smp purbalinga papar covid,12/4/2021,0
RANGERmounts,Negatif,ptm klaster sebar covid,12/4/2021,0
ulihape,Positif,giat ptm batas sekolah ana prokesnya gerbang cek suhu cuci tangan maksimal siswa temu,12/4/2021,0
jiedxy,Negatif,brngkt males ptm,12/4/2021,0
vlentinevlinci,Positif,sy ptm mark xi ips copyright copyright copyright,12/4/2021,0
xlaizva,Positif,yok semangat sekolah ptm,12/4/2021,0
bearcutiess,Negatif,alah ngantuk gamau ptm,12/4/2021,0
ImaSatrianto,Positif,deteksi level tuju tular masif tutup sekolah sangkut sekolah protokol sehat boleh lanjut ptm batas,12/4/2021,0
darl_Darlingr2,Positif,sekolah ptm yuhu,12/4/2021,0
cityroskies,Negatif,bsok ptm knp jam gin blom tidur ok now how slep,12/4/2021,0
h4ppytolearn,Negatif,ptm day sesuai ekspetasi,12/4/2021,0
eomgybu,Negatif,ptm sedih,12/4/2021,0
liilyzee,Negatif,gw beneran takut ptm,12/4/2021,0
kaylfx,Negatif,gasuka ptm,12/4/2021,0
putri1khansa,Positif,ptm semangat,12/4/2021,0
santi_imoet007,Positif,sekolah tatap muka batas bagi fase transisi fase bias fase transisi ptm batas satu didik,12/4/2021,0
dewishol1703,Positif,camat sekolah ptm batas ambil samplenya,12/4/2021,0
FirmRei,Positif,hore besok ajar tatap muka,12/4/2021,0
infodepok_id,Positif,kabar emak emak kota depok laksana simulasi ajar tatap muka batas ptmt didik anak usia paud taman kanak kanak tk sekolah dasar sd sekolah tengah smp simulasi ada selam,12/4/2021,0
1iyase_,Positif,ptm kiw wkwkwkw istirahat ajar trs jdi ngobrol wkwkwk copyright guru jdi aktif jwb ew,12/4/2021,0
astuti_,Positif,daerah ptm moga tempat susul ptm,12/4/2021,0
sukajaydenn,Negatif,takut mo ptm,12/4/2021,0
Bg_Vigor,Positif,bijak ptm jumlah sekolah,12/4/2021,0
C85LK,Positif,dukung bijak perintah laku ptm batas,12/4/2021,0
mmvjhh,Negatif,yalah males ptm semangat uang saku trade mark,12/4/2021,0
GenJuno,Positif,integrasi aplikasi peduli lindung amp implementasi level didik hasil tingkat akurasi statistik tingi pijak ambil putus prokes semangat ptm,12/4/2021,0
newithjie,Positif,ptm besok semangat,12/4/2021,0
zzations,Positif,neng ptm knp pembagianya dasar absen temenku absen,12/4/2021,0
Akumanisya1,Positif,anak kuliah tatap muka neng moga ptm jalan lancar sekolah prokes,12/4/2021,0
LynwoodBentrup,Positif,neng ptm simak tips tips terap protokol sehat sekolah prokes,12/4/2021,0
dstoryofibu,Positif,anak sekolah ptm males males dibuatin bekal sehat jaga jaga prokes ketat sekolah prokes,12/4/2021,0
kabarluwuk,Positif,gubernur sulteng,12/4/2021,0
taehdyna,Negatif,gk tuju ptm pake baju bebas luar senjang sosial takut murid pake pakai bebas pulang sekolah nongkrong ngumpul ngumpul pake seragam aman kaya nongkrong pk baju seragam skolah,12/4/2021,0
OceanBraeth,Positif,ptm,12/4/2021,0
diah_irawaty,Positif,sekolah ptm semangat,12/4/2021,0
kaiiigom_,Positif,cemungut pts ptm cemungut,12/4/2021,0
JeparaPolres,Positif,antisipasi kluster ptm,12/4/2021,0
yellowngambiss,Positif,ptm asik,12/4/2021,0
bimaprmbd,Negatif,knp sd ajar tatap muka kuliah susah ngatur anak sd patuh prokes ajar ofline anak kuliah,12/4/2021,0
Si_bodatt,Positif,vaksinasi percaya ptm laksa,12/4/2021,0
KeliRawang,Positif,moga ptm batas lanjut,12/4/2021,0
GATRA_com,Positif,nadiem jambi tengok vaksinasi,12/3/2021,0
nayaysjj,Positif,semangat besok ptm,12/3/2021,0
lipxjae,Positif,gais td dpt kabar sekolah ku ptm kek ptm taun onlen tnp tatap muka trus,12/3/2021,0
affatunnisa,Positif,guru vaksin ingetin ikut ptm aman semangat vaksin tenaga didik,12/3/2021,0
chinsun9_,Positif,strategi pandemi vaksin ptm guru vaksin semangat vaksin tenaga didik,12/3/2021,0
ditopuccino,Positif,sekolah tingkat positif lbh dr akibat ptm batas lapor perintah nga tingal diam aman prokes trade mark,12/3/2021,0
ginabicara,Positif,ad fakta bener kait isu siswa guru konfirmasi positif covid ptm batas prokes,12/3/2021,0
nusabalicom,Negatif,disdikpora kaji ptm,12/3/2021,0
AdolfoLotter,Positif,tenang sekolah terap ptm batas sekolah wajib sedia pilih pj cepat vaksinasi guru vaksin tenaga didik,12/3/2021,0
diantin_,Positif,daerah tendean jakarta anak tetanga ptm batas sekolah dinfo prokes tua murid surat pernyatan masuk ganti dasar absen,12/3/2021,0
drpriono1,Positif,hasil survei tg sekolah pandemi,12/3/2021,0
Little_Shovya,Positif,bayang gimana susah ajar paud online siswa alami sulit ptm batas prokes,12/3/2021,0
taklelahbang,Positif,lupa ingat guru tenaga didik vaksinasi ptm batas laku semnagat siap mari dukung ptm vaksin tenaga didik,12/3/2021,0
kimcipedes,Positif,ptm batas gelar,12/3/2021,0
svroberi,Negatif,abis ptm selau capek ajar uansjdsnskj jadwal ajar beranta,12/3/2021,0
afinyulia,Positif,tiga isu siswa guru positif covid ptm batas dasar fakta data asal satu sekolah verifikasi,12/3/2021,0
schfess,Negatif,sch ptm ntah kaya ganjel pikir gugup takut,12/3/2021,0
sallyfauzi,Positif,jadi salah anak teman bloger sekolah fara anak jin ikut ptm materi,12/3/2021,0
hyunjjne,Negatif,ptm mbl mbl mbl males loch,12/3/2021,0
yuniarinukti,Positif,kabar siswa guru konfirmasi positif covid sat laku ptm batas bingung murid sekolah sekolah cari tau prokes murid positif,12/3/2021,0
pjsungchie,Negatif,males bngt bsok ptm sie,12/3/2021,0
yourpouuu,Negatif,ptm sesi males ak,12/3/2021,0
entitasbuana,Negatif,males ptm,12/3/2021,0
ndiievania,Positif,tunda ptm rugi jangka siswa ortu damping anak ajar rumah senyum prokes,12/3/2021,0
stars_soonyoung,Positif,semangat ptm ptm,12/3/2021,0
Little_Shovya,Positif,suami bilang sekolah ptm batas siap prokes sekolah sehinga tua khawatir,12/3/2021,0
ditopuccino,Positif,nga ptm batas sila orangtua hrs didik anak nga smua orangtua bs ajar anak anak diomelin mulu bs bljr mandiri lo prokes trade mark,12/3/2021,0
lovelythv,Negatif,hadeh males besok ptm,12/3/2021,0
merdekadotcom,Negatif,tular covid siswa,12/3/2021,0
rl0Idl,Positif,ak ptm gais,12/3/2021,0
LaughHiard,Positif,semangat sy ptm harini,12/3/2021,0
stobevly,Positif,ptm,12/3/2021,0
adikasahii,Positif,tidur kei besok ptm,12/3/2021,0
clamourgrl,Negatif,besok jadwal ptm tidur ngerjain tugas,12/3/2021,0
IndonesiaNewsss,Positif,bupati sidak pasti pelaksanan ptm aman sebar covid,12/3/2021,0
9eong,Negatif,ptm fuck ngapain,12/3/2021,0
seoikjni,Positif,ok slamat ptm tasya,12/3/2021,0
debrandut,Negatif,khawatir ptm mingdep takut kaga temen takut paham materi takut bikin malu kelas,12/3/2021,0
XLawanPandemiX,Positif,prokes ketat sat ptm,12/3/2021,0
luvbgyura_,Negatif,takut mingdep ptm,12/3/2021,0
Ludyahannisa,Positif,ptm batas sjk brpa pekan jujur mbuat waras sy tingkat maklum nmanya emak newbie anak sekolah sbnrnya prokes sekolah wajib,12/3/2021,0
dollsucks,Positif,kek neng ptm,12/3/2021,0
vernonjaksel,Negatif,woi besok ptm gamau ikhlas,12/3/2021,0
kianajmn,Negatif,gamau sekolah ptm,12/3/2021,0
jwooxhine,Negatif,maksut sekolah ptm gogle met guru guru depan pakai kuota,12/3/2021,0
nisaahani,Positif,sekolah wajib bentuk satgas covid sosialisasi ptm batas sekolah tua murid berkordinasi puskesmas sembari prokes,12/3/2021,0
akbarpratamasta,Negatif,ajar tatap muka efektif murid gapunya muka,12/3/2021,0
babyhuangrenjun,Negatif,bom ptm bom ketemu males ngomong,12/3/2021,0
ManoharaSekar,Positif,respons orangtua murid pelaksanan ptm sat bagus bantu pelaksanan ptm sumbang disinfektan sekolah kerjasama tua guru lawan pandemi,12/3/2021,0
sqerum1,Positif,tuju ptm prokes ketat,12/3/2021,0
JhonSon61_,Positif,bijak ptm batas,12/3/2021,0
fl5gckuotw45o,Positif,ptm batas upaya selamat anak anak risiko dampak negatif ajar jarak panjang,12/3/2021,0
tuman_abu,Positif,terap prokes ptm anak usia dngn awas,12/3/2021,0
AureliaAsri,Positif,tua tuju atur prokes sekolah ptm,12/3/2021,0
celestialcha,Negatif,yalah besok ptm males,12/3/2021,0
reylsaa,Negatif,takut ptm,12/3/2021,0
eichiwibu,Negatif,sy takut ptm,12/3/2021,0
pringadi_as,Positif,metode ambil sampling kota kab minimal alokasi sesuai sekolah ptm batas camat,12/3/2021,0
itajegegbaliid,Positif,metode ambil sampling tiap kota kabupaten camat sekolah ptm batas batas otomatis ambil samplenya lupa prokes,12/3/2021,0
faultlessv,Negatif,kagak ptm tu anying,12/3/2021,0
beomgyuwbucinlo,Positif,ptm,12/3/2021,0
MeliEngku,Positif,takut lebih kait isu siswa guru konfirmasi covid ptm batas fakta data asal satu sekolah verifikasi,12/3/2021,0
cocacic0,Netral,ajar tatap muka laksana ok panik,12/3/2021,0
Adhitz_eza,Positif,siswa vaksin tetep ptm ikut protokol kesehatanya jaga prokes ketat sekolah prokes,12/3/2021,0
DragoonBall6,Positif,jalan prokes ketat ptm nyaman vaksin ajar rajin sekolah prokes,12/3/2021,0
mosquitoshutup,Positif,siswa semangat ajar muka moga hindar nama virus moga ptm jalan lancar sekolah prokes,12/3/2021,0
pooryouhaha,Positif,jaga jarak pakai masker baik moga ptm jalan lancar sekolah prokes,12/3/2021,0
Bubuq10,Positif,enak ptm tungu ditingal hm bimbang ajar rajin sekolah prokes,12/3/2021,0
3O5rb,Negatif,takut ptm trade mark,12/3/2021,0
Anggita_lung,Positif,presiden vaksin ptm batas tinjau vaksinasi ajar sukoharjo jawa,12/3/2021,0
ushijimayoo,Positif,ptm gasabar sekolah,12/3/2021,0
ti5yaa,Positif,dukung cepat ptm polisi kelar vaksinasi ajar klaten moga lacar,12/3/2021,0
secmiqqum,Negatif,sekolah ptm capek,12/3/2021,0
GoSumutdotcom,Positif,dukung ptm batas,12/3/2021,0
ggukyu,Negatif,yalah ptm,12/3/2021,0
ImaSatrianto,Positif,strategi integrasi aplikasi peduli lindung implementasi satu didik hasil statistik level akurasi tingi jadi patok ambil putus kait ptm batas,12/3/2021,0
urbasictauruss,Negatif,doh mls januari uda wajib ptm copyright,12/2/2021,0
Toypixarr,Positif,wilayah laksana tatap muka tenaga didik vaksin moga ptm jalan vaksin tenaga didik,12/2/2021,0
Ervinadiah4,Positif,satu didik jalan ptm batas laksana semangat ajar anak anak vaksin tenaga didik,12/2/2021,0
emmchuwy,Negatif,ribet anjir ptm,12/2/2021,0
kodim1509labuha,Positif,dansatgas tmd tinjau pelaksanan suluh stunting posyandu posbindu ptm,12/2/2021,0
ayanapunya,Positif,tular satu didik persentase data klaster data sekolah lapor sekolah sekolah ptm,12/2/2021,0
Antara_Kalteng,Negatif,puan maharani ingat sekolah paksa ptm penuh kriteria,12/2/2021,0
fania_surya,Positif,sekolah positivity ratenya ptm batas jalan siswa guru ajar tes karantina cegah prokes,12/2/2021,0
shinnnnmin_a,Positif,guru tenaga didik sekolah vaksin vaksin ingat mreka unjung sentra vaksin dekat mari dukung ptm vaksin tenaga didik,12/2/2021,0
FirmRei,Positif,dansatgas tmd tinjau pelaksanan suluh stunting posyandu posbindu ptm,12/2/2021,0
MeliEngku,Positif,pagi tweps rasa sekolah online sekolah laksana ptm batas turut prokes,12/2/2021,0
Lovely_Milaa,Positif,guru vaksinasi baik murid sehat mari dukung ptm vaksin tenaga didik,12/2/2021,0
MeliEngku,Positif,khawatir takut takut mana prokes dukung ptm batas,12/2/2021,0
eunbyeol71,Positif,dukung ptm batas huga dukung bapa guru vaksin loh lupa patuh prokes aman vaksin tenaga didik,12/2/2021,0
taeealrdk,Positif,tatap muka guru rindu temu mari dukung ptm vaksin tenaga didik,12/2/2021,0
kangDed18255164,Positif,direktorat sekolah dasar laku monev ptm sd muhamadiyah solo,12/2/2021,0
justlove4hee,Positif,neng ptm,12/2/2021,0
arinaamanda4,Positif,lintas telinga anak sekolah sedih dengernya anak anak sekolah tatap muka yu guru guru vaksin ptm vaksin tenaga didik,12/2/2021,0
Dyenhyun,Positif,ptm jangka patuh prokes laku vaksinasi aman vaksin tenaga didik,12/2/2021,0
Yasirarofat2,Positif,jala ajar tatap muka lancar tenaga didik vaksin ptm laksana mari dukung ptm vaksin tenaga didik,12/2/2021,0
Inayahnurul14,Positif,tenaga ajar wajib vaksin murid murid tenang ajar pikir takut vaksin guru mari dukung ptm vaksin tenaga didik,12/2/2021,0
messyjenoo,Negatif,sesi ptm,12/2/2021,0
nia_indah3,Positif,anak anak tua aman ajar sekolah ptm guru vaksinasi vaksin tenaga didik,12/2/2021,0
newsragen,Positif,siswa sman sumberlawang vaksin masal,12/2/2021,0
samLeinad,Positif,ajar jarak nilai optimal resiko learning los dampak prokes sat ptm batas,12/2/2021,0
kabarpolitik,Negatif,puan sekolah curi start ptm,12/2/2021,0
sunlthkim,Negatif,jujur sy males ptm,12/2/2021,0
haekaye,Negatif,males ptm trade mark,12/2/2021,0
MeliEngku,Positif,perintah tes pcr tenaga didik rutin minimal bulan upaya cegah tular laksana ptm batas prokes siswa kerja seko,12/2/2021,0
vervouz,Positif,males ptm enak ptm online,12/2/2021,0
LakarPolsek_Hms,Positif,kota surabaya jadi contoh nasional ajar tatap muka ptm persen kota surabaya nilai perintah pusat hasil cepat tangan pandemi covid lengar ptm humas polsek lakarsantri polrestabes surabaya,12/2/2021,0
baca_pesan,Positif,new post covid turun,12/2/2021,0
ImaSatrianto,Positif,bener interaksi ptm batas ganti sat online moga lancar prokes dpatuhi,12/2/2021,0
xhifuyu,Positif,alhamdulilah first thought it quite hard make friends there ptm duganku salah they re so kind baur asik jujur neng ptm,12/2/2021,0
ijabingan,Positif,ptm wkwkwkwkw,12/2/2021,0
asahimone,Positif,ok semangat semangat ptm jam jam gws gws gw semangat,12/2/2021,0
mbahndi,Negatif,kecewa kabar istri sekolah anak jalan ptm tingkat sd sesuai arah dinas didik kabupaten tangerang kekecewan khawatir didik anak sy kelas sd moga ptm,12/2/2021,0
GATRA_com,Positif,muncul klaster covid sekolah,12/2/2021,0
txtmyeuphoria,Positif,neng stelah gada mapel olga ptm olahraga,12/2/2021,0
moonareas,Positif,semangat ptm,12/2/2021,0
iDongkyuu,Positif,besok ptm duluan bye bye,12/2/2021,0
punggungxiao,Positif,smnjak pandemi ngerti skli materi sekolah trs skrg ptm syukur ngerti dikit krna dijelasin mingu ptm jadwal selang seling mingu depa pts ofline pusing,12/2/2021,0
hosh1_7,Positif,udahlah gais tidur besok first time ptm bye trade mark,12/2/2021,0
schfess,Positif,sch semangat izinin ptm ngerasa cemas gatau trivia darah fungsi angkut sari sari makan,12/2/2021,0
wonieridescent,Positif,panjang spotify kaya ptm,12/2/2021,0
nayupsyazZx_,Positif,tgs sy kir tulis tangan ptm mapel tugas catat syaraf tangan kanan sy kaku trade mark,12/2/2021,0
96kwh,Negatif,males besok ptm,12/2/2021,0
Miracas2,Positif,ptm dorong maju prestasi siswa tengah pandemi covid lawan hoaks vaksin,12/2/2021,0
chismojarela,Positif,php in mulu ama listrik nyala mati nyala mati unutung gosok nyetok air besok ptm,12/2/2021,0
demittte,Positif,bangun tidur terus pts abis pts terus ptm,12/2/2021,0
KaryatiNiken,Positif,sedih sbenarnya tunda ptm akibat rugi jangka siswa tuju mal tutup prokes,12/2/2021,0
DEWITOGEL1,Negatif,ketua dpr ri sekolah paksa ptm penuh kriteria,12/2/2021,0
viataniaaaa,Positif,asik temu murid murid ptm,12/2/2021,0
AttayaWtv,Positif,ptm anak usia sekolah prokes,12/2/2021,0
portalkuduscom,Negatif,muncul klaster ptm purbalinga,12/2/2021,0
bubbiiieuu,Negatif,takut ptm,12/2/2021,0
bitterbeen,Positif,neng ptm kek anjir,12/2/2021,0
nisaahani,Positif,btw sekolah boleh ptm batas sekolah ajar tenaga didik vaksinasi level pkm prokes,12/2/2021,0
Niningpoejiati1,Positif,moga persen moga patuh prokes sekolah daerah ptm,12/2/2021,0
HidayatHHP,Positif,deteksi level tuju tular masif tutup sekolah sangkut sekolah prokes boleh lanjut ptm batas sayang,12/2/2021,0
jpnncom,Negatif,gubernur ganjar pranowo klaster covid ptm timpa siswa smp negeri mrebet jadi hikmah,12/2/2021,0
taekoobou,Negatif,takut ptm,12/2/2021,0
ipatshoon,Negatif,ih males ptm gw ketemu temen gw grgr absen atas,12/2/2021,0
emmaasmawati2,Positif,lancar peran sekolah guru siswa kompak jaga prokes ptm batas laku prokes,12/2/2021,0
fairyyst,Negatif,mager bsk ptm,12/2/2021,0
inisayacakep,Negatif,takut takut kbm normal jarak rmh sekolah takut gabisa ngikutin ptm modar apalgi kbm normal,12/2/2021,0
felocityyy,Negatif,ptm klaster ptm wkwkwkwmwkwkw,12/2/2021,0
nyctophile_v,Positif,ptm semangat,12/2/2021,0
OfiSgumelar,Positif,strategi awas ptm batas deteksi karantina sampling warga sekolah ptm batas prokes,12/2/2021,0
KaryatiNiken,Positif,kunci ptm batas oerlu peran orangtua proaktif berkordinasi sekolah prokes,12/2/2021,0
Celengan_rindu9,Positif,pakai masker ajar sekolah dingin pandemi moga ptm jalan lancar sekolah prokes,12/2/2021,0
mozzareilla,Positif,ptm protokol sehat jaga ketat pakai masker sekolah prokes,12/2/2021,0
bieuzi00,Positif,syarat ptm jaga protokol sehat nakes awas jaga prokes ketat sekolah prokes,12/2/2021,0
rosseluckyy,Positif,masker dipake ptm batas bawa bekal bawa hand sanitizer moga ptm jalan lancar sekolah prokes,12/2/2021,0
sakurabloom_s,Positif,ptm batas siswa ganti wajib jalan protokol sehat semangat sekolah sekolah prokes,12/2/2021,0
rullyfebiansyah,Positif,siswa wajib vaksin ikut ptm ikut protokol kesehatanya semangat sekolah sekolah prokes,12/2/2021,0
republikaonline,Positif,paud tk ra,12/2/2021,0
Jodinjae,Negatif,males ptm ngak ptm ngak miskin trade mark,12/2/2021,0
HalloKlaten,Positif,tes antigen sat ptm,12/2/2021,0
ila_rizky,Positif,sekolah bs ptm batas sekolah kompak prokes dr guru murid kepsek dl peran ajar evaluasi rutin dr perintah ptm batas,12/2/2021,0
catatansicucuth,Positif,persentase sebar ptm batas edar data juli bilang sedih sedih prokes yup data juli hinga,12/2/2021,0
wuttzepp,Positif,ptm,12/2/2021,0
mediaindonesia,Positif,ptm batas agustus hinga sat uji coba ptm april,12/2/2021,0
rmonouh,Negatif,hmz mls ptm hmz,12/2/2021,0
TedjoKopelak,Positif,ptm prokes ikut vaksinasi,12/2/2021,0
AmdBadawi,Positif,ajar vaksin giat ptm,12/2/2021,0
troyestal,Positif,semangat pagi ptm,12/2/2021,0
jeaegers,Negatif,oh besok ptm males,12/2/2021,0
Little_Shovya,Positif,sembarang tahap pengawasanya ketat ptm batas,12/2/2021,0
SDIAZZAHRAH,Positif,sat seko patuh protokol sehat giat ajar tatap muka laksana lancar sd islam az zahrah palembang,12/2/2021,0
EduardoAdemarr,Positif,moga ptm laksana sekolah,12/2/2021,0
liputan6dotcom,Negatif,temu klaster covid sekolah,12/2/2021,0
worldIings,Positif,besok ku ptm,12/1/2021,0
heimorklee,Positif,ptm saudara saudara copyright copyright copyright,12/1/2021,0
humasreslamteng,Positif,dukung cepat ptm polres lampung polsek jajar gelar vaksinasi ajar lindung lindung maju sehat,12/1/2021,0
OfiSgumelar,Positif,isu siswa guru konfirmasi positif covid ptm batas data asal satu sekolah verifikasi valid prokes aman,12/1/2021,0
Shifansa21,Positif,moga capai vaksinasi guru cepat tuntas anak anak ptm batas anak anak kangen sekolah vaksin tenaga didik,12/1/2021,0
finakiyomi,Positif,untuk guru terima kasih sedia vaksin ptm batas semangat vaksin tenaga didik,12/1/2021,0
steyeweii,Positif,ptm batas buka tua pantau anak ikut protokol sehat semangat vaksin tenaga didik,12/1/2021,0
ijonsonad,Positif,vaksinasi bantu temu sentra vaksin dekat ptm batas laksana semangat vaksin tenaga didik,12/1/2021,0
ImronSanjaya8,Positif,efektivitas pj ptm sama capai ajar ayah bunda rasa mari dukung ptm vaksin tenaga didik,12/1/2021,0
GiselMaryam,Positif,tenaga didik vaksin patuh protokol sehat ptm vaksinasi guru ajar aman vaksin tenaga didik,12/1/2021,0
angusberesford,Positif,menko pmk vaksinasi anak tua percaya ajar tatap muka aman,12/1/2021,0
kumparan,Negatif,wakil ketua dpr sufmi dasco ahmad aku prihatin temu klaster covid sat ptm,12/1/2021,0
kuma_seo,Positif,fakta angka klaster ptm batas lho data lapor sekolah warga sekolah guru siswa perangkat sekolah tular covid infeksi klaster ptm batas prokes,12/1/2021,0
nursa1dr_,Positif,simpang siur klaster sat ptm fakta data hasil angka klaster data akumiulatif data ptm batas laku prokes,12/1/2021,0
swerbvy,Positif,ih ptm fira temen skrg,12/1/2021,0
4JEONGYOON,Negatif,tingal ngitung ptm math,12/1/2021,0
rrrrnjn,Positif,bener guru vaksin baik ptm laksana anak anak kangen sekolah vaksin tenaga didik,12/1/2021,0
DindaMe51,Positif,dukung vaksin tenaga ajar harga proses ajar tatap muka lancar mari dukung ptm vaksin tenaga didik,12/1/2021,0
querencianaz,Negatif,ptm anjir,12/1/2021,0
yoitsungie,Negatif,ptm senyum plis,12/1/2021,0
OfiSgumelar,Positif,peran guru kunci siswa disiplin terap prokes ptm batas sekolah anak anak seringkali bandel cuci tangan lepas masker gerombol,12/1/2021,0
ZayyanSiregar,Positif,didik vaksin ptm sesuai protokol sehat semangat ajar anak anak vaksin tenaga didik,12/1/2021,0
PutraSivia,Positif,lupa ayah bunda sehat ananda aman sat ptm mari dukung ptm vaksin tenaga didik,12/1/2021,0
OfiSgumelar,Positif,tua anak sekolah ptm batas sekolah fel ajar beda daring luring interaksi efektif tatap muka,12/1/2021,0
wtrmelonM,Positif,guru lupa vaksin lancar ptm batas anak anak kangen sekolah vaksin tenaga didik,12/1/2021,0
ginabicara,Positif,moga kabar dr sekolah ana ptm wajib prokes,12/1/2021,0
tangselifecom,Positif,sekolah parkir sesuai merek motor sekolah kaya asa dealer motor nanti siswa sekolah ajar tatap muka slamet jalan hobi tiktok xbyar,12/1/2021,0
ibuknya_jaksa,Positif,hasil positive rate sekolah sistem ajar ubah online baik protokol sehat sekolah direviu dinas kait prokes ptm batas,12/1/2021,0
ibuknya_jaksa,Positif,tunda ptm dpt akibat rugi jangka long term disbenefit bg siswa shg perintah fokus awas tingkat advanced surveilance dukung program ptm batas prokes,12/1/2021,0
beritakaltim2,Positif,pemprov boleh ajar tatap muka sma smk,12/1/2021,0
yourbunniest,Negatif,adil ptm kelas awal,12/1/2021,0
Yeni_Setiyawati,Positif,pasti prokes tunda ptm akibat rugi jangka long term disbenefit siswa sehinga perintah fokus awas tingkat advanced surveilance dukung program ptm batas,12/1/2021,0
cloudyhyu13,Negatif,males ptm besok knp vibes ptm sekolah normal libur mingu beda,12/1/2021,0
andiniharsono,Positif,siswa semangat dengar sekolah sdg tinjau ptm batas siswa siswa laksana prokes kepsek tenaga ajar vaksin lengkap,12/1/2021,0
sunwooch,Negatif,males ptm jam buang buang tenaga trs guru mapelnya,12/1/2021,0
sunfl0chan,Positif,gw neng ptm tbtb besok daring mksut,12/1/2021,0
Yettieherawati1,Positif,sat ajar sekolah ptm batas upaya perintah sat tua dukung didik anak bangsa terap prokes,12/1/2021,0
hyewonieee_park,Negatif,males lusa ptm,12/1/2021,0
ayojakartacom,Negatif,pemprov dki temu klaster ptm jakarta,12/1/2021,0
grapemintluv,Negatif,ptm msa jadwal salah hmz aneh,12/1/2021,0
dyhnrjch,Positif,morning ptm bay,12/1/2021,0
68ONEZA,Positif,today last day ptm ketemu mingu kedpn,12/1/2021,0
aastropphile,Positif,omg ptm,12/1/2021,0
fairyscosmo,Negatif,males bsk ptm sakit perut kntol,12/1/2021,0
nanoo0nn,Negatif,jadwal ptm senua,12/1/2021,0
prdfxx0,Positif,aq bobo dlu esok aq ptm lgi xixixi met bobo yanc,12/1/2021,0
kimguggie,Positif,besok ptm an,12/1/2021,0
shirayucki,Positif,copyright gelud fisika ajar dutch besok ptm mapelnya ingris yeay so excited rest wel mots we did great,12/1/2021,0
ISTHEB0YZ,Negatif,temen anak sma ptm gara gara word,12/1/2021,0
Little_Shovya,Positif,tua peran dukung hasil ptm batas sekolah prokes tua anak disiplin protokol sehat sekolah,12/1/2021,0
antaramakassar,Positif,legislator apresiasi rencana perintah laku ptm batas kampus,12/1/2021,0
radaraktual,Negatif,ajar tatap muka klaster tular covid sufmi dasco ahmad prihatin,12/1/2021,0
MirwanBzVauly,Negatif,sekolah klaster covid sat ptm siswa positif,12/1/2021,0
ndiievania,Positif,menjudge ortu izin anak ptm batas cerita proses data daerah semangat prokes,12/1/2021,0
kataecrina,Positif,ptm bawa untung,12/1/2021,0
AliBej0,Positif,ptm batas upaya perintah selamat anak anak risiko dampak negatif upaya serta protokol sehat ketat vaksinasi,12/1/2021,0
Adanday5,Positif,iyes dukung ptm prokes,12/1/2021,0
KembuaiU,Positif,ptm jabar aman klaster sekolah,12/1/2021,0
eyotgarble5589,Positif,dukung ptm batas jalan aman lancar kpai rekomendasi cek kawan,12/1/2021,0
FilmIndro,Positif,evaluasi cabang dinas laku awas cabang dinas laporanya alhamdulilah klaster papar ptm dedi,12/1/2021,0
SR_VIDHI,Positif,semangat abang ptm,12/1/2021,0
taeismaboo,Negatif,besok ptm males,12/1/2021,0
