username,Label,text,date,bot
voidotid,Negatif,perintah kota solo jawa tutup sekolah akibat warga sekolah papar positif covid giat ajar tatap muka ptm,10/18/2021,0
patweeties,Negatif,males ptm,10/18/2021,0
pftiewaa,Negatif,males ptm copyright,10/18/2021,0
skyblue6104,Negatif,ngantuk males ptm,10/18/2021,0
bookwannay,Positif,dah bsk sy ptm hiks semangat,10/18/2021,0
monylonyyy_,Negatif,takut ptm hadeh panik trade mark,10/18/2021,0
misterlaa,Negatif,males besok ptm,10/18/2021,0
nzhcl,Negatif,males besok ptm asa,10/18/2021,0
Ikhsan77804974,Positif,alhamdulilah ptm,10/18/2021,0
VIVAcoid,Positif,siswa sd kota bogor antusias sat uji coba ptm,10/18/2021,0
eauternal,Negatif,gasuka ptm,10/18/2021,0
snoweday,Positif,semangat ptm,10/18/2021,0
DaffaVonPolo,Positif,tuju ptm tradisi tulis tugas tugas buku tulis no ubah blended learning mengunakan teknologi we ned paperles generation our education,10/18/2021,0
lcvingsunu,Negatif,males mingu ptm,10/18/2021,0
iHugJayden,Negatif,beneran ptm anjim aduh males bangun pagi,10/18/2021,0
mmeeiix,Positif,semangat ptm aren jadwal sejarah trade mark,10/18/2021,0
loeyyaddct,Positif,ptm neng mls sosial,10/18/2021,0
nonniepkr,Negatif,males ptm,10/18/2021,0
scabiouzs,Negatif,males ptm,10/18/2021,0
chocobearchan,Positif,semangat ptm,10/18/2021,0
Glad926,Positif,pagi ptm byebye semangat,10/18/2021,0
Sunghonly_,Positif,selamat pagi semangat ptm daring moga senang,10/18/2021,0
jwngwun,Negatif,idieh ptm males,10/18/2021,0
twosunshinee,Negatif,ptm nyusahin,10/18/2021,0
meilyys,Negatif,males besok ptm,10/18/2021,0
jakemeja,Negatif,besok ptm males ck,10/18/2021,0
sparrojw,Positif,mending ptm tugas,10/18/2021,0
la_vider,Positif,ptm gada temen cewek,10/18/2021,0
bitterich,Negatif,males abis ptm pj,10/18/2021,0
ilyjngkk,Positif,ptm cape daring mulu,10/18/2021,0
matchalaeti,Positif,pts selesai mingu ptm copyright,10/18/2021,0
beaomgyu,Positif,ak ptm,10/18/2021,0
ailagistress,Positif,hlo semangat ptm semangat,10/18/2021,0
Ana_Ike,Positif,bentuk dukung sukses ptm batas prokes jemput anak masker on semprot sanitizer pemangilan aplikasi henti titik tentu turun kendaran,10/18/2021,0
MuryaniLina,Positif,peran aktif tua kalah sukses ptm batas ajar prokes rumah hinga bawa sekolah cerita papar,10/18/2021,0
faradilaaa,Positif,mixed opinion ptm batas tua newbie tua anak sekolah nyimak hehehe no opinion wrong fakta,10/18/2021,0
WieHakim,Positif,moga strategi perintah cegah klaster ptm batas sekolah solusi baik sekolah lupa prokes,10/18/2021,0
HidayatHHP,Positif,metode ambil sampling tiap kota kabupaten minimal persen alokasi sesuai sekolah ptm batas camat dukung ptm batas prokes,10/18/2021,0
Naywupinay,Positif,semangat mots ptm,10/17/2021,0
tszoentrbyun,Positif,god morning semangat sekolah ptm nice day trade mark copyright,10/17/2021,0
rrdxqq,Positif,neng fren harini ptm,10/17/2021,0
kooknqz,Negatif,males ptm,10/17/2021,0
yanngjungwonn,Negatif,gw males ptm,10/17/2021,0
pcrtaeyong,Positif,ptm,10/17/2021,0
jaeeihyun,Negatif,besok ptm males dha,10/17/2021,0
hi_iomg,Negatif,males besok ptm,10/17/2021,0
worldkyoong,Negatif,males besok ptm,10/17/2021,0
chrujiwoo,Negatif,males bsk ptm,10/17/2021,0
guniebe,Positif,smangat ptm besok bestie,10/17/2021,0
bibleedark,Negatif,males besok ptm lgi,10/17/2021,0
LVuittonJK,Negatif,males besok ptm mapel mtk,10/17/2021,0
jaywoniette,Negatif,besok ptm males sedih,10/17/2021,0
ecacanary,Positif,semangat ptm,10/17/2021,0
Emayant63176260,Positif,ptm terimakasih presiden jokowi,10/17/2021,0
Nurcahyaa1997,Positif,dukung jala ptm terimakasih presiden jokowi,10/17/2021,0
Miracas2,Positif,ptm dorong maju prestasi siswa tengah pandemi covid terimakasih presiden jokowi,10/17/2021,0
BangIcal07,Positif,ptm laksana cerdas bangsa terimakasih presiden jokowi,10/17/2021,0
AstiraSyanti,Positif,ptm pulau nusa lembongan sambut antusias siswa terimakasih presiden jokowi,10/17/2021,0
Adelia199701,Positif,terimakasih presiden jokowi ajar tatap muka buka,10/17/2021,0
suprmcityx,Positif,jujur ptm kek guru galak gt tegang pen pulang ak pilih daring,10/17/2021,0
0701ve,Negatif,takut bnget anjir ptm,10/17/2021,0
aeripangi,Negatif,gw ptm gatau panik takut gt pel guru kiler pasrah tugas gw bom kelar,10/17/2021,0
haejiehan,Positif,doain moga ac ptm,10/17/2021,0
CYPJMM,Positif,bsk ptm semangat,10/17/2021,0
user04005,Positif,bsk ptm semangat,10/17/2021,0
Ana_Ike,Positif,gimana siswa bukti positif pcr sesuai protokol positif covid karantina kontak erat isolasi ptm batas jalan prokes,10/17/2021,0
retnoWardhana,Positif,bener pantau efektif pelaksanan ptm sesuai atur tua aman lepas anak sekolah,10/17/2021,0
claragustinia,Positif,pendektesian level palibg tuju tular masif sekolah tutup sekolah prokes boleh ptm batas,10/17/2021,0
idasan12,Positif,sekolah peran sekolah guru siswa jalan prokes ptm batas jalan,10/17/2021,0
dekcrayon,Positif,persen ptm batas henti prokes ajar ganti daring sekolah sangkut tinjau ulang dinas didik,10/17/2021,0
EuisSriNur,Positif,bentuk awas pelaksanan ptm batas perintah tes pcr siswa tenaga didik sekolah rutin minimal terap prokes,10/17/2021,0
nunuhalimi,Positif,dilema ajar rumah ptm tunda ptm dampak jangka siswa sehinga perintah fokus awas tingkat advanced surveilance dukung program ptm batas prokes,10/17/2021,0
teeadnu,Positif,ku jakarta daerah antusias umum ptm hapy sambut prokes,10/17/2021,0
erfanologi,Positif,metode ambil sampling tiap kota kab minimal alokasi sesuai sekolah ptm batas camat prokes,10/17/2021,0
GenJuno,Positif,sekolah ptm prokes strategi deteksi surveilans didik ketat protokol sehat insya alah aman anak sekolah,10/17/2021,0
KompasTV,Negatif,ketua mpr pemda evaluasi pelaksanan ptm sebab muncul klaster covid jateng,10/16/2021,0
kampusinfo,Positif,mc majelis dikdasmen damping kesiap ptm sekolah,10/16/2021,0
IkhsanN75080567,Positif,ajar tatap muka jokowi bangun,10/16/2021,0
Akomeng6,Positif,ajar tatap muka respon kait tua tuju ptm tua dukung anak anak ajar sekolah ptm disiplin prokes,10/16/2021,0
night_sandi,Positif,mayoritas masyarakat dukung penuh pelaksanan ajar tatap muka ptm batas kian desak hindar generasi muda learning los turun capai ajar,10/16/2021,0
elanoure,Negatif,ngeselin ptm ganjil genap,10/16/2021,0
chocoojjh,Negatif,takut besok ptm,10/16/2021,0
Jakasaputraa11,Positif,ptm laksana,10/16/2021,0
lobeusick,Negatif,takut ptm jujur,10/16/2021,0
luckymklee,Negatif,males sy ptm trade mark trade mark trade mark trade mark,10/16/2021,0
erindadyyah,Positif,haru murid semangat ptm bsk,10/16/2021,0
shaaharu,Positif,beneran ptm yey,10/16/2021,0
preci0usjie,Negatif,beneran ptm takut copyright,10/16/2021,0
Miracas2,Positif,dukung ptm cegah lost generation jokowi bangun,10/16/2021,0
nasyholland,Positif,ptm takut,10/16/2021,0
catatankaqihati,Positif,alhamdulilah brapa daerah laku ptm prokes ketat ptm batas dpt didik maksimal tetnunya terap prokes ketat bosan ingat putra putri tuk patuh prokes,10/16/2021,0
mo8riarty,Negatif,males ptm fak,10/16/2021,0
baqkery,Negatif,bau bau ptm males,10/16/2021,0
jvonyxlavra,Negatif,ptm ih sedih mas bego,10/16/2021,0
Separoh_Kumis,Positif,cerdas generasi pandemi prioritas tenaga didik terap disiplin dlm jalan prokes giat ptm laksana,10/16/2021,0
BeritajatengNet,Negatif,temu klaster ptm purbalinga,10/16/2021,0
liputan6dotcom,Negatif,headline sekolah klaster covid ptm batas,10/16/2021,0
schfess,Negatif,sch sekolah ku tanda tanda ptm nang haha,10/16/2021,0
peachezjm,Positif,semangat darink ptm pts giat semangat,10/16/2021,0
Little_Shovya,Positif,apa putus ambil tua ptm batas ajar rumah mari harga dapat timbang prokes kendor,10/16/2021,0
Dwiaprily,Positif,salah paham miskonsepsi kait isu klaster ptm isu gt gt tular klaster ptm batas capai satu didik fakta data kumulatif juli data prokes,10/16/2021,0
forleehc7,Positif,morning semangat ptm,10/15/2021,0
convomf,Positif,trade mark semangat ptm,10/15/2021,0
97GRYFFBOY,Positif,semangat pagi semangat ptm,10/15/2021,0
ccrssaa,Positif,pagi mutualan risa semangat pj ptm lupa sarap nice day,10/15/2021,0
blueberrieszn,Positif,ptm neng dha ketemu temen,10/15/2021,0
karrstudy,Positif,ptm lumayan,10/15/2021,0
pirrbukanbuah,Positif,moga next ptm ful,10/15/2021,0
haimocca,Negatif,semingu ptm tugas aneh aneh,10/15/2021,0
jawapos,Positif,pemkab wonogiri izin ptm batas jenjang gelar,10/15/2021,0
RADARSUKABUMI,Positif,november kuliah tatap muka ptm buka,10/15/2021,0
scelimoot,Negatif,hue mingdep ptm,10/15/2021,0
mrkimjk,Positif,sekolah ptm,10/15/2021,0
celierel,Positif,ptm bagi pj anjir liat dongo planga plongo ngerti trade marksoalnya guru fokus ptm pj dibiarin trade mark,10/15/2021,0
bacotbgtgila,Positif,sumpah ptm anjir,10/15/2021,0
deydiaries,Positif,ptm bgtchwijakajiaksksj asa purba ngobrol ama,10/15/2021,0
anditaw50,Positif,dukung ptm,10/15/2021,0
binjeuz,Positif,ptm tdi,10/15/2021,0
paluuketokk,Positif,ptm jokowi bangun negeri,10/15/2021,0
pacarkyle,Negatif,ptm males,10/15/2021,0
__hirofumi,Positif,alhamdulilah ptm sekolah gw,10/15/2021,0
sohnyoungdjae,Positif,semangat ptm korban buly kabar wkwk,10/15/2021,0
4lyss_,Positif,ptm sernyata seru pagi kola kaya abis soljum ngambil ijazah maen maen rumah temen wkwkwk,10/15/2021,0
tehtariksatuu,Negatif,ptm buka santai naudzubilah,10/15/2021,0
BARNRTC,Negatif,ptm capek,10/15/2021,0
nikiiiriki,Positif,ptm buruk bayang,10/15/2021,0
jaeminftui,Positif,ptm cmn ketemu,10/15/2021,0
userberryjam,Positif,ptm ampun,10/15/2021,0
primaradiosby_,Positif,sekolah surabaya gelar ptm,10/15/2021,0
Joglosemarnews,Negatif,untung wonogiri gelar ptm,10/15/2021,0
mediaindonesia,Positif,dinas sehat kabupaten lembata,10/15/2021,0
SonoraFM92,Positif,wali kota solo gibran rakabuming raka dinas sehat tes swab antigen acak sekolah laksana ptm batas,10/15/2021,0
wartapati,Negatif,muncul kluster didik,10/15/2021,0
anditaw50,Positif,ptm butuh,10/15/2021,0
immortaalmoon,Negatif,anjir ready ptm,10/15/2021,0
kabartimlo,Positif,bupati klaten klaim ptm jalan sesuai prokes,10/15/2021,0
trisulis98,Positif,langkah langkah ambil tular masif tutup sekolah sangkut sekolah protokol sehat boleh lanjut ptm batas,10/15/2021,0
toekangkuliner,Positif,tular sat ptm batas capai data komulatif juli data bulan,10/15/2021,0
catatansicucuth,Positif,harap vasin anak usia paud sd vaksin laksana ptm batas prokes kasihan vaksin,10/15/2021,0
dee_arif,Positif,oh teman teman pelaksanan metode perintah pelaksanan ptm batas prokes,10/15/2021,0
Little_Shovya,Positif,sekolah izin ptm batas sekolah wilayah pkm level siswa ajar vaksinasi lupa ptm batas prokes,10/15/2021,0
dekcrayon,Positif,perintah awas tingkat level camat proses ptm batas jalan lancar kendala prokes tes pcr rutin minimal bulan,10/15/2021,0
gemaulani,Positif,tunda ptm akibat rugi jangka siswa perintah fokus awas tingkat dukung program ptm batas pakai metode prokes,10/15/2021,0
YogaPras_,Positif,pera ptm batas gulir sekolah ajar tatap muka batas guru prokes anak didik tat disiplin prokes,10/14/2021,0
chiamistry,Negatif,ptm huhuhu mager sumpah,10/14/2021,0
billbigwindong,Positif,ptm yok semangat,10/14/2021,0
BismaMalikkk,Positif,sukses ptm tengah pandemi covid jokowi bangun negeri,10/14/2021,0
R42JAEM,Positif,smangat besok ptm copyright,10/14/2021,0
jngwooya,Positif,ptm jugatpi ksl sie kemaren,10/14/2021,0
trashituhidup,Positif,ptm lebi ful rumah trs ngejer materi latsol soshum,10/14/2021,0
hrjmuffins,Negatif,males ptm sekolah skdhskdgaksj,10/14/2021,0
sayalusia,Positif,moga ptm jalan lancar aman,10/14/2021,0
salahurat,Positif,ptm lu,10/14/2021,0
AstiraSyanti,Positif,ptm dilkukan cerdas hidup bangsa,10/14/2021,0
ItsVnie,Positif,ptm lumayan,10/14/2021,0
Vaaxstudy,Positif,ptm kawan,10/14/2021,0
Cinta63445780,Positif,ptm laksana jokowi bang,10/14/2021,0
rubyridersz,Positif,alah ptm pj dianaktirikan,10/14/2021,0
Octdelack,Positif,semangat ptm,10/14/2021,0
DepkolektorS,Positif,ptm dorong motivasi ajar jokowi bang,10/14/2021,0
Threelovelys,Positif,ptm semangat ptm,10/14/2021,0
eunoiamark,Negatif,yalah males ptm,10/14/2021,0
ganyru,Negatif,tolak ptm,10/14/2021,0
BiruNanas,Positif,semangat besok ptm jam gin blom tidur smoga bablas,10/14/2021,0
nielsskyy,Negatif,bsk ptm males,10/14/2021,0
lavientxt,Negatif,ptm gw takut,10/14/2021,0
amariue,Negatif,males ptm ih jujur moga besok dapet bangu deket kipas angin,10/14/2021,0
cigsftersad,Positif,ptm alah jatuh cinta irl,10/14/2021,0
amariue,Negatif,jujur males besok ptm jam sampe jam numpang absen abis tidur,10/14/2021,0
saltandtsuki,Negatif,males ptm,10/14/2021,0
yourbf2021,Positif,mingdep ptm semangat,10/14/2021,0
vullofff,Positif,asik bentar ptm,10/14/2021,0
mightbehurtabit,Negatif,alah besok ptm males,10/14/2021,0
zwhyun1,Negatif,apan mingu ptm an ohmejot gimana nal trade mark trade mark,10/14/2021,0
jwahope,Positif,moga ptm besok lancar guru kalem,10/14/2021,0
ambsbrngdyn_,Negatif,males asli pagi pagi hujan ptm,10/13/2021,0
kookiebee,Positif,neng ptm,10/13/2021,0
lovjies,Negatif,males besok ptm,10/13/2021,0
lowshannyy,Positif,okt ptm asli neng,10/13/2021,0
ggookiekoo,Negatif,ptm gaseru gapunya temen sedih,10/13/2021,0
jeyilucu,Negatif,nyebelin ptm mas ajh kasih tugas anjenk,10/13/2021,0
ffluvhx,Negatif,cape ptm,10/13/2021,0
ljnpuyiee,Positif,ptm asik parah,10/13/2021,0
peterparkerqq,Negatif,cape ptm,10/13/2021,0
raechanlv,Positif,ptm bro,10/13/2021,0
catetajaa,Positif,sgera ptm vaksin lindung,10/13/2021,0
classicyuno_,Positif,ptm parah,10/13/2021,0
anditaw50,Positif,dukung ptm,10/13/2021,0
MutiaSa98970942,Positif,ptm laku jaga kualitas anak bangsa vaksin lindung,10/13/2021,0
kezaddra,Negatif,mingdep ptm takut suruh ngisi help,10/13/2021,0
MinC900,Positif,dukung ptm vaksin lindung,10/13/2021,0
lovyspring,Negatif,let tel ptm,10/13/2021,0
anditaw50,Positif,ptm,10/13/2021,0
mulubaaer,Positif,siswa antusias ikut ptm vaksin lindung,10/13/2021,0
hunnysroom,Negatif,mingdep ptm takut,10/13/2021,0
dellperkedell_,Positif,ptm,10/13/2021,0
ppakjwie,Negatif,ptm cape,10/13/2021,0
valluvvvtae,Negatif,besok ptm males,10/13/2021,0
addowrable,Positif,semangat ptm ayangie trade mark trade mark,10/13/2021,0
mechamarv,Positif,ptm,10/13/2021,0
IdChatnews,Netral,sekolah murid orangtua disiplin terap protokol sehat pelaksanan ajar tatap muka ptm batas cipta klaster sekolah,10/13/2021,0
AdyaDanastri,Negatif,takut ptm,10/13/2021,0
_iamsahikyu,Positif,ptm tpi rada srek lingkung skolah copyrightjujur mas kaku,10/13/2021,0
dzefault,Negatif,capek ptm ish,10/13/2021,0
cloudydoy1,Negatif,cape suruh ptm suruh ngerjain tugas online,10/13/2021,0
s0leaj,Positif,neng ptm tugas kurang,10/13/2021,0
tamabcdefg,Positif,alhamdulilah kemarin ptm moga lanjut sya paham materi pj,10/13/2021,0
sayaesha,Positif,terimakasih ptm paham matematika senyum,10/13/2021,0
onyournajaee,Positif,ptm gasie,10/13/2021,0
posrnhub,Positif,semangat ptm,10/13/2021,0
dlorfys,Positif,fak ptm,10/13/2021,0
diorpdf,Negatif,ptm anjir,10/13/2021,0
OKaconk,Negatif,detiknews ribu guru murid positif covid ptm,10/13/2021,0
TirtoID,Negatif,kepala bidang advokasi iman zanatul haeri aku,10/13/2021,0
yanahaudy,Positif,ganti ptm yeay emaknya piket schol no wkwkwkw,10/13/2021,0
QueenOfRed2,Positif,kunjung komisi dprd kota sukabumi pantau siap jelang ptm,10/13/2021,0
ditopuccino,Positif,sekolah wajib satgas tugas sosialisasi ptm batas kordinasi puskesmas dukung prokes bahagia sehat,10/13/2021,0
andiniharsono,Positif,teliti ajar jarak optimal learning los dampak satu didik tingkat paud sd butuh ptm batas prokes,10/13/2021,0
dian_ismy,Positif,wali murid peran prokes rumah anak rumah sekolah tua lapor izin anak ptm batas demam sakit lai,10/13/2021,0
nunuhalimi,Positif,perintah dorong sekolah ptm maksimal prokes terap metode ambil sampling tiap kota kabupaten minimal persen,10/13/2021,0
rhiskafidi,Positif,milik peran loh pelaksanan ptm batas dr perintah tenaga didik wali murid siswa prokes,10/13/2021,0
DayatRain,Positif,metode ambil sampling tiap kota kabupaten minimal persen alokasi sesuai sekolah ptm batas camat prokes,10/13/2021,0
teeadnu,Positif,pasti mempersiapkn jalan pro kes bawa masker anti bawa hand sanitizer ptm wajib prokes,10/13/2021,0
ainurputrama1,Positif,kira sat ptm tugas sat daring,10/13/2021,0
catatansicucuth,Positif,untung perintah erti ptm batas jalan prokes masif jalan,10/13/2021,0
FirmRei,Positif,pemkot dprd kaji atur ptm parepare,10/12/2021,0
Beritaupdate17,Positif,tuju ajar tatap muka,10/12/2021,0
ZonaPriangan,Negatif,murid sd papar covid ajar tatap muka paksa henti,10/12/2021,0
pertiwi86957822,Positif,ajar tatap muka ptm dorong maju prestasi siswa tengah pandemi covid,10/12/2021,0
SMuhmer,Positif,dukung ajar tatap muka,10/12/2021,0
lampungpostid,Positif,pelaksanan ajar tatap muka ptm bandar lampung jalan bulan hinga sat temu klaster sekolah,10/12/2021,0
TemanPain,Positif,ajar tatap muka prestasi siswa tergangu jokowi bangun negeri,10/12/2021,0
sdmuh1solo,Positif,asyik blended learning ajar tatap muka,10/12/2021,0
ffairyjae,Negatif,bsk ptm males,10/12/2021,0
T4KlGF__,Positif,ngantuk jadwal ptm semangat,10/12/2021,0
snoopy_loff,Positif,semamgat ptm takut,10/12/2021,0
jjzx__,Positif,gw neng ajar ptm rumah gw dr sekolah njr paksa dr rumah hrs berangkat jm,10/12/2021,0
jeyilucu,Negatif,takut besok ptm pls,10/12/2021,0
harutobayi,Negatif,males besok ptm,10/12/2021,0
httpschaan,Negatif,males bsk ptm,10/12/2021,0
bearvelated,Negatif,besok ptm malas jujurly,10/12/2021,0
niaqkun,Positif,semangat ptm takut ptm,10/12/2021,0
epochvee,Positif,ptm tu srius,10/12/2021,0
pakicang,Negatif,ptm lelah,10/12/2021,0
trisulis98,Positif,semangat ptm,10/12/2021,0
suarasmanisda,Positif,ones semangat ptm,10/12/2021,0
M0RKIE99,Negatif,ptm,10/12/2021,0
hmdashiu,Negatif,bsk ptm anjer takut,10/12/2021,0
subschfess,Positif,pasuk jam jam ngantuk sch btw semangat ptm,10/12/2021,0
airincantip,Positif,plg ptm hihi mayan,10/12/2021,0
dianrestoe,Positif,alhamdulilah kemarin anak bungsu vaksin sintas tungu vaksin vaksin dosis senang ikut ptm batas sekolah,10/12/2021,0
jongiwon,Negatif,stres ptm,10/12/2021,0
lawahoda,Positif,anak anak ptm cerdas ajar jokowi bangun negeri,10/12/2021,0
AyuNadi66,Positif,dukung ptm jokowi bangun negeri,10/12/2021,0
halahkepoloe,Positif,ptm day,10/12/2021,0
sadgurlpisan,Positif,ptm tu asli,10/12/2021,0
istri_umin,Positif,tbh ptm daring,10/12/2021,0
lialxii,Positif,ptm siang,10/12/2021,0
Chocooboos,Negatif,ptm ngebosenin,10/12/2021,0
sweetpersea,Negatif,ptm males daring gabut,10/12/2021,0
preciousjisung,Positif,ptm semangat,10/12/2021,0
salehdaulay,Positif,dpr dukung ptm testing vaksinasi sekolah guru tingi,10/12/2021,0
00115DKH,Positif,plis ptm ful cepetan kelar covid,10/12/2021,0
creespychick,Negatif,jujur gk ptm,10/12/2021,0
Jakewonbiased,Positif,god pagi semangat ptm,10/12/2021,0
DNVYLEEJENO_,Positif,oiya semangat ptm daring,10/12/2021,0
yeonjvnganteng,Positif,neng hri ptm,10/12/2021,0
BlDUANN,Positif,ptm,10/12/2021,0
echanlofs,Negatif,ptm ribet bat,10/12/2021,0
premswarut,Negatif,ptm tu cape,10/12/2021,0
Flying_bird0510,Positif,nungu sikecil pulang skul ptm hapy semangat bngt sengaja turun mamah mamah muda,10/12/2021,0
namericanows,Positif,semangat daring semangat ptm,10/12/2021,0
skylines0110,Positif,tua bijak dukung ptm nongkrong seko,10/12/2021,0
IDCorner,Negatif,update klaster sekolah purbalinga jepara,10/12/2021,0
medan,Positif,pkm kota medan turun level,10/12/2021,0
kompascom,Negatif,klaster,10/12/2021,0
seriuskan,Negatif,ptm ajg mls,10/12/2021,0
chcocrvch,Negatif,ptm mas kasi tugas,10/12/2021,0
Anandita11_,Negatif,mingdep ptm minus ku nambah daring,10/12/2021,0
nunuhalimi,Positif,positif klaster ptm batas lapor sekolah guru murid tata laksana sekolah positif infeksi sekolah terap prokes,10/12/2021,0
nisaahani,Positif,sekolah guru siswa harap terap prokes laksana ptm batas,10/12/2021,0
TatiSuherman,Positif,peran tua kalah sukses ptm batas proaktif berkordinasi sekolah keluarga infeksi anak dispilin protokol sehat prokes,10/12/2021,0
nunuhalimi,Positif,khawatir baca info covid klaster sekolah imbas langsung ptm batas telah miskonsepsi prokes,10/12/2021,0
nunuhalimi,Positif,deteksi level tuju tular masif duh tutup sekolah sangkut sekolah protokol sehat ptm batas,10/12/2021,0
ditopuccino,Positif,sekolah positif anak kelas tes karantina ptm batas bs jalan prokes,10/12/2021,0
OfiSgumelar,Positif,strategi ambil kemenkes kemendikbud kait ptm batas kuat protokol sehat ubah perilaku strategi deteksi surveilans,10/12/2021,0
GenJuno,Positif,ortu peran biasa anak prokes dlm ptm batas,10/12/2021,0
bairuindra,Positif,tiga isu siswa guru konfirmasi positif covid ptm batas fakta data asal satu sekolah verifikasi prokes,10/12/2021,0
LilStory_,Positif,salut langkah perintah ptm sing anak anak guru ortu prokes teru,10/12/2021,0
jpradarsemarang,Negatif,guru wonosobo dapat langar prokes sat ptm,10/11/2021,0
KoranMercusuar,Positif,madrasah sulteng laksana ptm,10/11/2021,0
republikaonline,Positif,pemda aku temu klaster covid ptm,10/11/2021,0
ARIFILIZER,Negatif,curi start main petak umpet pulang pintu sekolah pakai seragam pakai sepatu posting ptm socmed,10/11/2021,0
jijindut,Positif,sekolah sekolah laksana ptm patuh protokol sehat,10/11/2021,0
republikaonline,Negatif,ptm sekolah guru covid henti,10/11/2021,0
tkislamcitramum,Positif,alhamdulilah giat ajar tatap muka batas tahap oktober,10/11/2021,0
KangQomaar,Negatif,gw sekolah ajar tatap muka mending stop sekolah dateng jam pulang ptm sarana ngumpul siswa micu tawur siswa bogor inalilahi ngeneskan dengernya,10/11/2021,0
KharinKLN,Negatif,ajar tatap muka rebah,10/11/2021,0
hmdnrrfnaauia,Positif,dukung ajar tatap muka dosen sempet twiteran,10/11/2021,0
Darmabakti21,Positif,ajar tatap muka ptm ptm pk patuh protokol sehat pk gagal laksana kacau,10/11/2021,0
night_sandi,Positif,mayoritas masyarakat orangtua murid dukung pelaksanan ajar tatap muka ptm batas kian desak hindar generasi muda learning los turun capai ajar,10/11/2021,0
woniecaa,Positif,ptm semangat,10/11/2021,0
chanainhere,Positif,morning al semangat ptm jiakh,10/11/2021,0
choxogi,Negatif,ptm anj males,10/11/2021,0
mdslaves,Negatif,males ajg besok ptm,10/11/2021,0
peachysexc,Positif,argshsghshs ptm,10/11/2021,0
xxaraaxz,Positif,semangat besok ptm,10/11/2021,0
hwa8san,Negatif,males ptm anjir gada temen,10/11/2021,0
dumpfromher,Positif,sekolah bingung bingung ptm rate today,10/11/2021,0
subakkies,Positif,selamat ptm besok pagi uda mat,10/11/2021,0
DPRIANGASIH,Negatif,takut november ptm anjir,10/11/2021,0
subakkies,Positif,ptm mapel ingris ips,10/11/2021,0
nvis29,Negatif,yailah ptm kuliah,10/11/2021,0
cikenpotato,Positif,ptm pulang jam gin nungu angkot hujan laper gila ngerasain fel kaya suka kesel senyum aneh,10/11/2021,0
ifvsugar,Negatif,ptm males,10/11/2021,0
haechanbulungan,Negatif,ptm freak,10/11/2021,0
jiaspage,Positif,ptm neng,10/11/2021,0
cibistudy,Positif,ptm tungu tungu sekolah neng ketemu temen ptm nice day,10/11/2021,0
asarthurs,Positif,jujur ptm lawa kayak faktor duduk deket circle pojok asik,10/11/2021,0
mglvve,Positif,ptm dh jam msukny kpagian anjr,10/11/2021,0
simpliest9,Positif,ptm pls,10/11/2021,0
tyamatayakul,Positif,ptm ajar sejarah tidur menit mimpi nyenyak,10/11/2021,0
agusasytora69,Positif,alhamdulilah kbm ptm batas jalan lancar aman selamat moga barokalah fidini fidunya wal akhirah,10/11/2021,0
omaigathsh,Positif,ptm rem,10/11/2021,0
ksjmyg13,Negatif,first day ptm pusing anjir rebah copyright,10/11/2021,0
Deradztt,Positif,firts time ptm tagihin tugas mulu,10/11/2021,0
hopegrcy,Positif,ptm neng guru huhu,10/11/2021,0
subschfess,Negatif,sch kesel ptm bawa ngamuk ngamuk sekolah jahat dikucilin,10/11/2021,0
Kthjwwkmg,Negatif,ptm cuman capek,10/11/2021,0
jejeajey,Negatif,ptm kacau anjrit,10/11/2021,0
cynstdy,Negatif,tuhan takut ptm,10/11/2021,0
Freyr_Rey,Negatif,cape anjir ptm energi kuras plis bangun kasur guru ngeselin,10/11/2021,0
TambubolonL,Positif,ptm efektif apresiasi kerja jokowi,10/11/2021,0
TambubolonL,Positif,ptm laksana apresiasi kerja jokowi,10/11/2021,0
skyochin,Positif,plis ptm,10/11/2021,0
anditaw50,Positif,ptm dorong maju prestasi siswa,10/11/2021,0
ranikusumaa_,Positif,semangat ptm enga diem bobo,10/11/2021,0
fluffyssei,Negatif,males ptm sesi siang,10/11/2021,0
jayles__,Positif,ptm sptnya,10/11/2021,0
silversvkoo,Negatif,males ptm ketemu gajelas anjeng,10/11/2021,0
heelovemee,Positif,semangat ptm semangat,10/11/2021,0
DEOBIYAGI,Positif,ptm bosen rumah,10/11/2021,0
doublejlouves_,Positif,semangat uda ptm stay safe mas daring semangat,10/11/2021,0
scelervyy,Negatif,mager bngt ptm elah,10/11/2021,0
royalsnja,Positif,ptm semangat daring rumah semangat,10/11/2021,0
_jaexpeachies,Positif,semangat ptm,10/11/2021,0
kookoomiii,Positif,semangat ptm,10/11/2021,0
idntlkmatcha,Positif,ptm semangat,10/11/2021,0
heeddlesuh,Positif,ptm semangat daring jugak,10/11/2021,0
yeagereast,Negatif,males ptm pdhl semingu cuman,10/11/2021,0
auliamntr,Negatif,tarik ptm,10/11/2021,0
jodohnya_tae19,Positif,semangat besok ptm,10/11/2021,0
kaedheraa,Positif,neng anjrit bsk ptm pdhl,10/11/2021,0
prkgvrn,Negatif,males bat besok ptm,10/11/2021,0
picknavaz,Negatif,suka ptm,10/11/2021,0
nagiv,Positif,jujur ptm wkwkwk,10/11/2021,0
na_denia,Positif,semingu ptm batas pts neng kondisi suasana,10/11/2021,0
11yjmloves,Negatif,bsk ptm males,10/11/2021,0
study_nirmala,Negatif,nyesel ptm manusia ngadi ngadi,10/11/2021,0
Naaiilllll,Negatif,ptm semangat,10/11/2021,0
zoerchive,Positif,ptm,10/11/2021,0
ayodisisme,Positif,alah anjrit ptm kemaren niat sampe tas siapin problem muncul,10/11/2021,0
ayodisisme,Negatif,bener hahahah efektif ptm enga alias enga ptm absen anjrit like,10/11/2021,0
0502izaa,Negatif,ptm gajelas mai sesi an gada temen ngobrol hwuwheu,10/11/2021,0
Anandita11_,Positif,ptm semangat sampe pulang,10/11/2021,0
P0IPIKU,Negatif,malesnya ptm panas,10/11/2021,0
Rarahvs,Positif,enak ptm anjir rumah babu,10/11/2021,0
