username,Label,text,date,bot
lawahoda,Positif,ptm anak anak juang jokowi,11/6/2021,0
Norayaki4,Positif,ptm dorong maju prestasi siswa tengah pandemi covid juang jokowi,11/6/2021,0
lgbtqtaro,Negatif,bom ptm,11/6/2021,0
reginskrt,Positif,ih keren kamera ptm motion sensor senyum,11/6/2021,0
tearotaro,Negatif,mingdep ptm,11/6/2021,0
vikakurniawati,Positif,isu tiga siswa konfirmasi positif covid ptm batas fakta data asal satu sekolah verifikasi pusing denger isu,11/6/2021,0
radaradapaham,Positif,perintah gegabah mutusin ptm batas direview rutin laksana,11/6/2021,0
suci_risalah,Positif,cluster ptm batas nga bener trnyata positif sat ptm sekolah sekolah terap prokes minim,11/6/2021,0
akunovitania,Positif,yup turut peran sekolah guru siswa jaga protokol sehat sekolah tingi prokes laksana ptm batas tuju ngak tweps,11/6/2021,0
duniaqtoy,Positif,monitoring ketat camat sekolah buka ptm potensi tular camat pasti tingi epidemilog sekolah uda buka ptm lepas tnp awas,11/6/2021,0
ibuknya_jaksa,Positif,sekolah temu positif positivity rate positif covid karantina amp kontak erat disolasi ptm batas sekolah bs jalan dukung dg prokes,11/6/2021,0
githasiwi,Positif,gaes perintah fokus awas tingkat advanced surveilance dukung program ptm batas prokes,11/6/2021,0
FionazIsza,Positif,perintah ambil metode ambil sampling kota kabupaten ptm minimal prokes,11/6/2021,0
Ria_Bilqis,Positif,strategi perintah kendali covid cegah klaster ptm batas sekolah prokes terap prilaku strategi deteksi,11/6/2021,0
21BeritaTerkini,Negatif,infografis klaster covid muncul sekolah ptm batas,11/5/2021,0
ajengNN,Positif,rapat dada uji coba ajar tatap muka batas sumpah neng mod boster mingu temu,11/5/2021,0
Darmaningtyas,Netral,bingung bpk ajar tatap muka ptm laksana penuh mal restoran wisata buka ful tmsk alasanya ajar vaksin restoran mal vaksin,11/5/2021,0
Rivo1014,Positif,sekolah kota jayapura sd smp hinga sma smk laksana ajar tatap muka,11/5/2021,0
Fjr23_,Positif,mahasiswa kaget diverse opinion pandang beda aneh moga cepat cepat kondisi pandemi landai hinga ajar tatap muka laksana kasi virtual learning los hilang alam hidup,11/5/2021,0
jellymyeon,Negatif,besok ptm gw males wkwk gk ush apaya gk dateng gp gk,11/5/2021,0
r4ayra,Positif,kangen ptm anjir,11/5/2021,0
cloudstoryy,Positif,ptm,11/5/2021,0
lmyself04,Positif,kangen alah ptm toa lap belah ngak kedengeran,11/5/2021,0
jonathansurbak1,Positif,alhamdulilah siswa sma smk riau positif covid ptm,11/5/2021,0
Rayaraa_liv,Positif,ptm whahaha,11/5/2021,0
youniecity,Negatif,males mingu ptm,11/5/2021,0
croissantheu,Positif,alhamdulilah ful ptm,11/5/2021,0
ayo_dolanbareng,Positif,ana neng ptm,11/5/2021,0
rebaahaan,Positif,sumpah ptm td,11/5/2021,0
tawantxt,Negatif,jujur males ptm,11/5/2021,0
eunbindomie,Positif,enak ptm anjir,11/5/2021,0
dja_sya,Positif,sekolah ptm asek ptm,11/5/2021,0
nyerahbelajar,Positif,semangat ptm pj,11/5/2021,0
ininevira01,Positif,ptm materi ptm trade mark,11/5/2021,0
hilycious,Positif,ptm weh tugas dikit sekolah dijelasin materi trus ngerjain latih nilai cuman bahas bareng copyright,11/5/2021,0
bobatins,Negatif,males ptm,11/5/2021,0
thastdy,Positif,semangat ptm ketemu temen temen semangat ptm dapet duit,11/5/2021,0
reenjunhh,Negatif,aduh males ptm,11/5/2021,0
oyevael,Negatif,siang ptm males,11/5/2021,0
milodinosaurrr,Negatif,males ptm alah,11/5/2021,0
fellskis,Positif,semangat ptm,11/5/2021,0
industrycoid,Positif,anak buah anies baswedan blak blakan covid ptm kepala dinas didik provinsi dki jakarta,11/5/2021,0
monitorindo,Positif,gawat klaster sekolah muncul,11/5/2021,0
PDI_Perjuangan,Positif,tinjau vaksinasi ajar serang,11/5/2021,0
aynjnnt,Positif,malam gm thesis esok gm elektif isnin gm ptm pastu gm tu gm celik seksyen,11/5/2021,0
loublounge,Negatif,hri ku sekul ptm angjie takut bangat,11/5/2021,0
kawgyeseo,Negatif,ptm sat panik,11/5/2021,0
teeadnu,Positif,prokes semangat orangtua mempersiapkn ptm batas doa pandemi leuasa ajar temu guru,11/5/2021,0
catatansicucuth,Positif,ampun ngajarinya untung ptm batas prokes,11/5/2021,0
duniaqtoy,Positif,trus denger isu siswa amp guru positif ptm fakta data verifikasi satu sekolah byk data sesuai data murid sekolah terconfirm positif lbh byk dbanding jmlh muridny,11/5/2021,0
KaryatiNiken,Positif,anak ptm batas prokes,11/5/2021,0
andiniharsono,Positif,cerita keponakan sd ibu ikut les tambah proses ajar maksimal lengah fokus ajar online prokes sekolah siap ptm batas ajar sekolah,11/5/2021,0
sallyfauzi,Positif,sesuai arah presiden ptm batas laksana sekolah pkm level tenaga didik vaksinasi,11/5/2021,0
mahardika98,Positif,sisi perintah laksana masyarakat milik tuju sehinga hasil bagus ptm batas,11/5/2021,0
dekcrayon,Positif,sekolah antisipasi sebar covid ptm batas prokes anak anak bagi kelompok wajib pakai faceshield kelompok anak kelompok ganti semingu,11/5/2021,0
Little_Shovya,Positif,isue bilang siswa guru konfirmasi infeksi covid ptm batas prokes,11/5/2021,0
fania_surya,Positif,dlm terap metode ambil sampling kota kabupaten minimal persen alokasi sesuai dg jmlh sekolah ptm batas inti sampel ambil camat sekolah ptm batas,11/5/2021,0
ElshintaDotcom,Positif,wakil ketua mpr evaluasi pelaksanan ptm cegah klaster covid,11/4/2021,0
malangvoice,Positif,ptm jalan terap prokes hinga masker cadang,11/4/2021,0
PRFMnews,Positif,nadiem makarim kampus takut gelar ptm,11/4/2021,0
kompascom,Negatif,total tenaga didik positif covid dki jakarta siswa hitung,11/4/2021,0
Antara_Jabar,Positif,dprd jabar pantau protokol sehat sekolah gelar ptm news jawa barat,11/4/2021,0
kumparan,Positif,lapor siswa guru ptm kota solo papar covid,11/4/2021,0
spmedia_jbg,Netral,timbang ajar tatap muka gelar mnurunya level grafik pmberlakuan pmbatasn kegiatn msyarakat pkm level level tenaga didik kependidikn ptk dn pserta didik usia minimal total trdata konfirmasi mlakukn vaksinasi,11/4/2021,0
erinajulia,Netral,klaster sebar virus orangtua tingal rumah rumah teman guru seko sat ajar tatap muka rekomendasi vaksin anak,11/4/2021,0
RianaDewie,Netral,berita data infeksi anak loh lapor hasil ajar tatap muka negara tingkat rawat inap anak kena covid,11/4/2021,0
erinajulia,Netral,mulai laku ajar tatap muka daerah rekomendasi vaksin anak kontrol tular transmisi covid,11/4/2021,0
bunda_sugi,Positif,alhamdulilah aman bismilah aman anak anak sekolah jaga prokes ketat ajar tatap muka jaga jarak imun boster kayak rekomendasi vaksin anak,11/4/2021,0
parksuamee,Netral,ajar tatap muka beberapa daerah vaksinasi anak jaga rekomendasi vaksin anak,11/4/2021,0
dariwulan23,Netral,ajar tatap muka daerah jalan rekomendasi vaksin anak kontrol tular transmisi covid,11/4/2021,0
jenlemine,Positif,pagi mots nice day btw semangat ptm,11/4/2021,0
_Kyungjvn,Positif,morning mots ptm semangat,11/4/2021,0
asahichingu,Positif,daring sma ptm semangat smua trade mark,11/4/2021,0
imLina____,Positif,pagi semangat ptm,11/4/2021,0
jietown,Positif,semangat ptm,11/4/2021,0
szunghan,Negatif,males ptm,11/4/2021,0
yfanagi,Negatif,males ptm,11/4/2021,0
faragemes,Negatif,males ptm,11/4/2021,0
seumsic,Positif,suka ptm,11/4/2021,0
RF18novalludi,Negatif,dih males ptm,11/4/2021,0
aerambis,Positif,semangat ptm,11/4/2021,0
yooyouha,Positif,kangen ptm,11/4/2021,0
137CYJ,Negatif,alah takut ptm,11/4/2021,0
KTC4XJ1,Positif,ptm,11/4/2021,0
ddongsichegn,Negatif,ptm huh males,11/4/2021,0
melatidr_,Negatif,omg males bngt ptm,11/4/2021,0
cukupsekalesaja,Negatif,males ptm,11/4/2021,0
ffairyjae,Positif,selamat pagi semangat ptm,11/4/2021,0
BAN9YE,Positif,btw semangat ptm daring god luck moga encok,11/4/2021,0
lilioasphodelu1,Positif,pagi ptm cung semangat nice day,11/4/2021,0
aboutvaa,Negatif,males bsk ptm,11/4/2021,0
j8iope,Negatif,males bngt ptm roling,11/4/2021,0
r4nsweet1e,Positif,neng besok ptm giat pramuka,11/4/2021,0
heejingoreng,Negatif,hdh males bner bsk ptm,11/4/2021,0
shndethu,Positif,semangat brok ptm gws,11/4/2021,0
skeleteos,Negatif,males ptm ajing,11/4/2021,0
mendodol,Positif,ptm kemaren,11/4/2021,0
jabarnewss,Netral,satgas covid monitoring pelaksanan ptm sukagalih cianjur,11/4/2021,0
jawapos,Positif,klaster sekolah,11/4/2021,0
fokus_satu,Positif,sman kota cimahi laksana ptm,11/4/2021,0
detikHealth,Negatif,satgas covid buka ribu sekolah klaster covid,11/4/2021,0
mmallxxsss,Positif,pts ptm mapelnya indo pkn ekonomi alhamdulilah gada itung an,11/4/2021,0
skycaca12,Positif,senen ptm hiks,11/4/2021,0
T4EBINIST,Positif,pulang ptm,11/4/2021,0
jakescrystall,Positif,ptm efektif sbg ofline liat apa papan erti ajar,11/4/2021,0
seinandung,Negatif,ptm ajg,11/4/2021,0
RAsmaraningsih,Positif,peran orangtua peran sukses ptm batas prokatif berkordinasi sekolah komunikasi prokes,11/4/2021,0
nisaahani,Positif,tiga isu siswa guru konfirmasi positif covid ptm batas fakta data asal satu sekolah verifikasi data sesuai prokes,11/4/2021,0
hallo_wulandari,Positif,sekolah ptm batas sekolah wilayah level pkm ajar tenaga didik vaksinasi loh prokes,11/4/2021,0
Ria_Bilqis,Positif,klaster ptm batas lapor sekolah warga sekolah guru siswa perangkat sekolah tular covid infeksi klaster ptm batas prokes,11/4/2021,0
ennymamito,Positif,sekolah protokol sehat boleh lanjut ptm batas prokes,11/4/2021,0
githasiwi,Positif,camat sekolah ptm batas otomatis ambil samplenya prokes,11/4/2021,0
Lullaby_96,Positif,alokasi sesuai sekolah ptm batas camat,11/4/2021,0
Little_Shovya,Positif,ptm batas kabar perintah rutin tes pcr siswa tenaga didik ruting bulan pasti prokes,11/4/2021,0
ibuknya_jaksa,Positif,metode dlm awas dg ambil sampling tiap kota kabupaten minimal alokasi sesuai dg sekolah ptm batas camat sekolah hrs prokes,11/4/2021,0
FatimahAqila,Positif,strategi deteksi surveilans satu didik masif iring pemberlakuanya ptm batas,11/4/2021,0
infoKALTENG,Positif,ptm batas palangka raya uji coba,11/3/2021,0
detikcom,Positif,wali kota solo gibran rakabuming raka dinkes random testing sekolah antisipasi covid sat giat ptm,11/3/2021,0
tvOneNews,Negatif,ketua dpr ri sekolah paksa ptm penuh kriteria,11/3/2021,0
cutsarah,Netral,ajar tatap muka efektif anak anak covid anak anak interaksi keluarga baik ekonomi,11/3/2021,0
littlezsun,Negatif,males ptm,11/3/2021,0
cintanyajihoon,Positif,ptm semangat,11/3/2021,0
sunshincx,Negatif,males besok ptm,11/3/2021,0
soyameiw,Negatif,males besok ptm,11/3/2021,0
vistytheworld,Negatif,alah capek siang ptm cap jari otw rumah,11/3/2021,0
xlmaryhs,Negatif,ptm nyiksa anjirt,11/3/2021,0
koozki,Negatif,males besok ptm,11/3/2021,0
chhlane,Positif,selese ptm kelas gk sabar sekolah masuk semingu,11/3/2021,0
yutaeo,Positif,sekolah ptm,11/3/2021,0
schfess,Positif,sch semangat ptm gais nice day sender pkl,11/3/2021,0
bucin_leejihoon,Negatif,yalah gw benci ptm gw gada temen anjg,11/3/2021,0
3CON0MY,Positif,ptm,11/3/2021,0
ociillll,Negatif,skshsj males ptm tu ngantuk anj,11/3/2021,0
malivalayaa,Positif,semangat ajar nana ptm,11/3/2021,0
jaeedotae,Negatif,ptm males anjrit,11/3/2021,0
hxndery_,Negatif,males ptm,11/3/2021,0
soujmark,Negatif,males ptm,11/3/2021,0
areangeluh,Negatif,ptm malesin tau tidur rumah,11/3/2021,0
jakeloxvly,Positif,asik ptm trade mark,11/3/2021,0
rarangdan,Positif,gais ptm,11/3/2021,0
gyuuclouds,Positif,mitu iyanih sibuk gegara ptm sedih semangat ily,11/3/2021,0
gyuminas,Positif,ptm smangat al,11/3/2021,0
PurpleColors__,Positif,pagi semangat ptm,11/3/2021,0
lleeyya_,Positif,morning ptm daring semangat,11/3/2021,0
O8SCB11,Positif,pagi semangat kelas ptm,11/3/2021,0
rillyuzi,Positif,ptm,11/3/2021,0
giysho,Positif,ptm sedih,11/3/2021,0
RBonafida,Positif,presiden joko widodo tinjau vaksinasi masal sma serang,11/3/2021,0
suaramerdeka,Negatif,sikap muncul kluster covid sekolah,11/3/2021,0
Balimulya,Positif,ndoro jateng sekolah ptm,11/3/2021,0
IDCorner,Negatif,cegah klaster,11/3/2021,0
massdoyie,Positif,besok aing ptm,11/3/2021,0
happyadrina,Negatif,aduh ptm,11/3/2021,0
Tribun_Bogor,Negatif,ajar tewas kota bogor dedie rachim dukung kcd tunda ptm tingkat sma,11/3/2021,0
lovingielmo,Negatif,gamau ptm,11/3/2021,0
iiloooll,Negatif,ptmt capek gimana ptm,11/3/2021,0
encokcore,Positif,mampus ptm trus ad ulang ips dua,11/3/2021,0
convomfs,Positif,ptm vaksin,11/3/2021,0
groumme,Positif,plis gw pgn ptm anjink,11/3/2021,0
tumqial,Negatif,stres ptm kejar kejar tugas tetep skrol twiter,11/3/2021,0
skies7chil,Positif,motsku just comeback home after ptm hu hu cape panas,11/3/2021,0
JWNL0VE,Positif,mots ptm,11/3/2021,0
Dwiaprily,Positif,dukung ptm batas gimana haru ana girang perintah putus ptm ma bosen sekolah online kelas mi smp kelas tidur zom main hape melulu,11/3/2021,0
MariaGSoemitro,Positif,miskonsepsi tular klaster ptm batas capai satu didik fakta data komulatif juli data,11/3/2021,0
Rohmahdg,Positif,bagus tingal laksana anak anak pandu disiplin jalan prokes sat ptm batas,11/3/2021,0
ImaSatrianto,Positif,berita edar tular klaster ptm batas capai satu didik fakta data komulatif juli data,11/3/2021,0
rhiskafidi,Positif,fyi manteman sekolah boleh laksana ptm batas sekolah level pkm tenaga didik laksana vaksinasi,11/3/2021,0
FatimahAqila,Positif,keren deteksi perintah pantau ptm batas jalan lancar sehinga ptm khawatir,11/3/2021,0
TatiSuherman,Positif,positivity rate sekolah atas persen perintah tes deteksi sebar seko plis jaga prokes positif proses ptm batas,11/3/2021,0
bairuindra,Positif,peran tua kalah sukses ptm batas proaktif berkordinasi sekolah keluarga infeksi anak dispilin protokol sehat prokes,11/3/2021,0
githasiwi,Positif,alokasi sesuai sekolah ptm batas camat prokes,11/3/2021,0
MIRATIPRIMASARI,Positif,harap ptm prokes mantap perintah konsentrasi laku strategi kendali covid sifat hulu strategi prokes ubah perilaku strategi deteksi surveilans,11/3/2021,0
ginabicara,Positif,perintah dlm bijak ud dipikirin ptm wajib prokes,11/3/2021,0
ImaSatrianto,Positif,salah strategi perintah cegah klaster ptm batas sekolah kuat protokol sehat ubah perilaku strategi deteksi surveilans ikut twetku pagi,11/3/2021,0
jiespoca,Negatif,males ptm irtu tuju,11/3/2021,0
ngopibareng_id,Positif,jatim klaim kluster ptm sma smk slb,11/2/2021,0
Suara_Pantau,Negatif,sekolah duga papar covid ptm jakarta,11/2/2021,0
hariankompas,Negatif,ajar tatap muka kota semarang jawa henti hinga pekan buntut tular covid sekolah sekolah bentuk satgas covid,11/2/2021,0
anisanaf,Positif,asa an video finaly ajar tahap normal tatap muka,11/2/2021,0
adilalatass,Positif,laku vaksinasi imunitas jaga ajar tatap muka jalan lancar cemas vaksin covid anak,11/2/2021,0
EunoiaNugraha,Positif,anak anak lupa vaksin vaksinasi sehat aman anjur sekolah ajar tatap muka takut vaksin vaksin covid anak,11/2/2021,0
sunscreenmahal,Positif,semangat ptm,11/2/2021,0
markhrto,Negatif,males ptm,11/2/2021,0
svanillove,Positif,god morning al ptm semangat,11/2/2021,0
xixiximrxnxi,Negatif,males ptm,11/2/2021,0
xxbzya,Positif,pagi ptm smangat,11/2/2021,0
flowersbbyz,Negatif,males ptm,11/2/2021,0
hyuckgotme,Negatif,ptm plis males,11/2/2021,0
sideofvinz,Negatif,males ptm pls,11/2/2021,0
convomfs,Positif,selamat pagi semangat ptm senyum,11/2/2021,0
hometomyshit_,Negatif,males ptm bray,11/2/2021,0
shaondsun,Positif,jujur suka ptm wkwk,11/2/2021,0
lucasgfie,Negatif,males besok ptm,11/2/2021,0
humankasatmataa,Positif,semangat ptm pekan,11/2/2021,0
Melatii44778729,Positif,hadue semangat besok ptm alah bentar,11/2/2021,0
lelebiey,Positif,eiya semangat besok ptm,11/2/2021,0
sadgirlrl,Negatif,males besok ptm,11/2/2021,0
avocxddo,Negatif,males besok ptm,11/2/2021,0
srndptvy,Negatif,bsok ptm anj males,11/2/2021,0
jaemd0y,Negatif,besok ptm sedih mager ih,11/2/2021,0
yjhees,Positif,neng bsk ptm bareng temen lengkap,11/2/2021,0
yyoitt,Negatif,besok ptm males,11/2/2021,0
kdayend,Negatif,elah besok ptm males anjg,11/2/2021,0
schfess,Positif,sch ptm woy capek jalan habis dijelasin guru materi otak kek pj telinga kanan telinga kiri,11/2/2021,0
kefihc,Negatif,besok ptm mager ahsgajhs,11/2/2021,0
haaeechaan,Positif,temen ptm,11/2/2021,0
princejakeuu,Negatif,males ptm bolos ye,11/2/2021,0
ffluvhx,Positif,syukur ptm pj ngaret tugas,11/2/2021,0
grapemintluv,Negatif,males ptm males zom,11/2/2021,0
chuifuyumatsu,Negatif,besok ptm males,11/2/2021,0
nyacheng_,Negatif,ptm boring sampe molor njir,11/2/2021,0
scagfpcy,Positif,semangat ptm,11/2/2021,0
loavswonie,Positif,ptm stay safe,11/2/2021,0
t4rowthu,Negatif,males ptm,11/2/2021,0
momouing,Negatif,males ptm,11/2/2021,0
vollesone,Negatif,males ptm,11/2/2021,0
innertaekoo,Negatif,males ptm mas ngantuk,11/2/2021,0
ackermaines,Negatif,lemes ptm,11/2/2021,0
milksuya,Positif,morning ptm semangat janlup mam,11/2/2021,0
jgnsoker_,Negatif,besok ptm males,11/2/2021,0
canjbag_,Positif,semangat bsk sy ptm trade mark,11/2/2021,0
byywinn,Positif,ptm,11/2/2021,0
reauroraa,Negatif,besok ptm males,11/2/2021,0
sat0ryu,Negatif,males besok ptm,11/2/2021,0
jvkookt,Negatif,males ptm siang panas keburu mager,11/2/2021,0
BP_Kaskus,Positif,bp klaster sekolah muncul,11/2/2021,0
OfficialRCTI,Negatif,guru siswa tular covid ptm semarang,11/2/2021,0
TangselTerbaru,Negatif,siswa smpn mrebet positif covid,11/2/2021,0
indo_pers,Positif,wabup ipat monitoring ptm sekolah sekolah ingat sekolah,11/2/2021,0
icasaurs,Positif,gimana ptm,11/2/2021,0
pcy_loeypark,Positif,ptm,11/2/2021,0
diorwantsme,Positif,start ptm nie,11/2/2021,0
jujutsru,Positif,bismilah mental kuliah ptm,11/2/2021,0
sydneyeol,Negatif,ptm duduk guru panik anjrit,11/2/2021,0
idntimes,Positif,kemendikbud dukung pemda terap ptm batas,11/2/2021,0
echimustika,Positif,pasti peran orangtua kalah sukses ptm batas proaktif berkordinasi sekolah jk klg infeksi anak dispilin protokol sehat anak sehat baik rumah,11/2/2021,0
Yettieherawati1,Positif,sat sekolah ptm batas sekolah level pkm,11/2/2021,0
toekangkuliner,Positif,deteksi kurang tular masif tutup sekolah sangkut sekolah protokol sehat boleh lanjut ptm batas,11/2/2021,0
erfanologi,Positif,fakta angka klaster ptm batas data tsb lapor sekolah warga sekolah guru siswa perangkat sekolah tular covid infeksi klaster ptm batas prokes,11/2/2021,0
trisulis98,Positif,tuju ptm batas kota dilanjutin angka tular cov landai prokes insyaloh aman,11/2/2021,0
rhiskafidi,Positif,guru sekolah info walimurid bulanya pcr laksana ptm batas prokes,11/2/2021,0
AraNiagara1,Positif,tunda ptm timbul rugi jangka siswa ortu ikut stres untung perintah program ptm batas fokus fokus awas tingkat,11/2/2021,0
bukananakbanjar,Negatif,can hate ajar tatap muka batas,11/1/2021,0
monologis_id,Negatif,perintah provinsi jawa henti ajar tatap muka ptm sekolah kota semarang temu tular covid sekolah,11/1/2021,0
ccanadaroads,Negatif,temen temen ajar tatap muka batas gaberani ketemu dibilangin sosial gaberani,11/1/2021,0
eightetic,Negatif,males ptm gw ngantuk,11/1/2021,0
thvxyrd,Positif,pagi semangat ptm,11/1/2021,0
mahedly,Positif,pagi al semangat ptm semangat,11/1/2021,0
jisungbinjai,Negatif,males ptm anjg,11/1/2021,0
shoonshined,Positif,semangat ptm,11/1/2021,0
sincerelynaila,Negatif,males ptm anying,11/1/2021,0
forkarinae,Positif,semangat bsk ptm senyum,11/1/2021,0
markleeter,Negatif,males bngt ptm ajg bau bau ph tatap muka,11/1/2021,0
narrysdaughter_,Negatif,lusa ptm yalah takut,11/1/2021,0
SiSablengg,Positif,ptm,11/1/2021,0
Lavchu_rain,Negatif,bsk ptm malas,11/1/2021,0
ohicecubes,Positif,ptm ketemu tyt gw temen omaigat pdhl gada temen smp dr,11/1/2021,0
andnajj,Negatif,cape ptm,11/1/2021,0
bluexnoo,Positif,smangat ptm gais hapy kiyowo,11/1/2021,0
vantenev,Negatif,ptm pulang,11/1/2021,0
Naisphase,Negatif,males ptm sesi siang,11/1/2021,0
jjuniekitten,Positif,ptm bosen daring sedih,11/1/2021,0
kunniefrenzz,Negatif,ptm ngantuk,11/1/2021,0
ppickes,Negatif,males ptm ck,11/1/2021,0
5tarlightt,Positif,ptm semangat vote,11/1/2021,0
hyukainara14,Positif,ptm semangat daring jga vote,11/1/2021,0
sunarinmine,Negatif,duh ptm takut,11/1/2021,0
rrosieclub,Negatif,males ptm,11/1/2021,0
ghafiraa,Negatif,takut ptm sedih,11/1/2021,0
digitalouver,Positif,semangat teman teman ptm ganbarimashou,11/1/2021,0
abinjw,Negatif,gaseru dateng ptm dikit,11/1/2021,0
convomfs,Positif,ptm stres rumah,11/1/2021,0
minjeee_07,Positif,pagi god day semangat ptm hati sekolah daring semangat sedih,11/1/2021,0
holawinwin,Positif,pagi senang ptm,11/1/2021,0
pancakesbubbly,Positif,god morning ptm semangat copyright,11/1/2021,0
txtdarijustine,Positif,ptm efek gw cape,11/1/2021,0
cyujinwrld,Negatif,males ptm dh,11/1/2021,0
lovinghjsXD,Netral,gatau dh neng sedih tau ajar tatap muka,11/1/2021,0
keishaalmara,Positif,pagi semangat ptm daring,11/1/2021,0
luvshuadino,Negatif,alah ptm males,11/1/2021,0
seungret,Negatif,besok ptm anjir males,11/1/2021,0
redyellowz,Positif,nyesel gw ptm,11/1/2021,0
prekedeI,Positif,ptm jugak,11/1/2021,0
hiikhave33,Positif,neng skolah sy kelas ptm,11/1/2021,0
melankoliskedua,Positif,woi ptm,11/1/2021,0
nyrathn,Positif,semangat ptm daring,11/1/2021,0
fairyaleaa,Positif,semangat ptm al,11/1/2021,0
captivateing,Positif,morning ptm semangat,11/1/2021,0
SerikatNews_,Positif,muncul klaster didik,11/1/2021,0
fullsumchanie,Negatif,ptm anjirt sesi bestie sedih,11/1/2021,0
0studyies,Positif,ptm beda sesi temen ku,11/1/2021,0
AraNiagara1,Positif,pelaksanan ptm batas sukses masyarakat libat peran ortu butuh proaktif berkordinasi sekolah keluarga infeksi anak prokes,11/1/2021,0
toekangkuliner,Positif,harap sekolah bsa jalan program ptm batas protokol sehat moga pandemi,11/1/2021,0
khariesmayani,Positif,insya sekolah oktober ptm batas prokes trade mark,11/1/2021,0
nona_melinda_,Positif,tular klaster ptm batas capai satu didik fakta data komulatif juli data coba,11/1/2021,0
andiniharsono,Positif,sekolah dg lulus syarat ptm batas area sekolah wastafel lengkap dg sabun cuci tangan ukur suhu terap jaga jarak prokes,11/1/2021,0
FionazIsza,Positif,moga ptm jalan lancar,11/1/2021,0
peachalpacca,Negatif,gasiap ptm,11/1/2021,0
DiahAgustinaWu1,Positif,sekolah ptm batas perintah tes pcr siswa tenaga didik sekolah rutin minimal prokes aman ptm,11/1/2021,0
dianrestoe,Positif,bilang angka klaster ptm batas data lapor sekolah warga sekolah guru siswa perangkat sekolah tular covid infeksi klaster ptm batas,11/1/2021,0
gulagulalilegit,Positif,tunda ptm akibat rugi jangka long term disbenefit siswa sehinga perintah fokus awas tingkat advanced surveilance dukung program ptm batas prokes,11/1/2021,0
DayatRain,Positif,camat sekolah ptm batas otomatis ambil samplenya prokes,11/1/2021,0
KaryatiNiken,Positif,ngak strategi deteksi surveilans masif jalan laku ptm batas prokes,11/1/2021,0
GenJuno,Positif,anak paud amp sd ptm batas rasa anak repot online prokes,11/1/2021,0
Little_Shovya,Positif,tua mengijinkan anak ikut ptm batas sekolah prokes tenang moms ijinkan ajar rumah diskriminasi proses hukum ajar rumah,11/1/2021,0
hello_fika,Positif,ngak sembarang loh sekolah ptm syarat prokes guru guru vaksin,11/1/2021,0
anakdolan_,Negatif,pakar sehat ptm evaluasi imbas muncul klaster sekolah,10/31/2021,0
medcom_id,Negatif,gibran tutup sekolah klaster covid sat ptm batas,10/31/2021,0
yesti_yes,Positif,ajar tatap muka latih bangun cepat telat latih multitasking masak latih sabar ingat jaga jarak wash hand tetep kuat jam pulang tetep tiada ubah kuat bestie,10/31/2021,0
TNLESO10,Positif,semangat ptm bestie,10/31/2021,0
shuavvd,Positif,pagih semangat jdwl ptm,10/31/2021,0
oikawoology,Positif,semangat mingu ptm,10/31/2021,0
rriksg,Positif,pagi semngat ptm smngt online ak mingu ptm,10/31/2021,0
convomfs,Positif,semangat ptm,10/31/2021,0
intakasep,Negatif,ptm males,10/31/2021,0
quitespaces,Negatif,males ptm tidur,10/31/2021,0
gorgeoustaewin,Positif,yok semangat ptm,10/31/2021,0
d0raThe3xploRrr,Negatif,males bsok ptm,10/31/2021,0
zwooflwr,Negatif,males besok ptm,10/31/2021,0
deryypng,Negatif,males bngt bsok ptm,10/31/2021,0
natachoco_,Negatif,males bsok ptm,10/31/2021,0
ghiovit,Positif,neng besok ptm yay,10/31/2021,0
skiesuwoo,Negatif,besok ptm malesin,10/31/2021,0
nnnnnaatt,Negatif,bsk ptm males,10/31/2021,0
feylise,Negatif,besok males ptm,10/31/2021,0
shanflorence_,Negatif,ptm males sistem shift,10/31/2021,0
nanaziiee,Positif,semangat nugas bsk ptm,10/31/2021,0
cremepuffie,Negatif,males besok ptm,10/31/2021,0
anntrjoo,Positif,semangat ptm besok,10/31/2021,0
diemajakamuya,Positif,hm semangat ptm,10/31/2021,0
diemajakamuya,Negatif,males ptm anying bagi pel ajha sie,10/31/2021,0
sygfess,Negatif,say males ajar tatap muka anak cowok kelas salty kek komen jelek status wasap hp mobil pake lakuin cowok mulut lemes,10/31/2021,0
aiyyyz,Positif,terima kasih ajar tatap muka batas alhamdulilah gantung mengunakan gambar remaja jompo bantu tolong ful tatap muka fulday trade mark,10/31/2021,0
mauambisbolegak,Positif,pagi ptm semangat yeu,10/31/2021,0
jesuisraraaa,Negatif,males ptm ajg males,10/31/2021,0
_sojeonghwan,Negatif,males besok ptm,10/31/2021,0
chaewens,Positif,semangat ptm,10/31/2021,0
koutarroo,Negatif,mager ptm,10/31/2021,0
lovsmachine,Negatif,males ptm,10/31/2021,0
jmhcn,Negatif,males besok ptm,10/31/2021,0
puyeeeng,Negatif,aduh males besok ptm anjir,10/31/2021,0
dzefault,Negatif,males besok ptm,10/31/2021,0
Sseungzmin,Negatif,males ptm,10/31/2021,0
theoOxzh,Negatif,besok ptm males trade mark,10/31/2021,0
PartaiSocmed,Positif,ptm angap anak sehinga layak taruh nyawa,10/31/2021,0
fokus_satu,Negatif,siswa guru positif covid,10/31/2021,0
GATRA_com,Positif,simulasi ptm,10/31/2021,0
AlifJunianto89,Positif,ptm juang jokowi,10/31/2021,0
jaeviees,Positif,ptm abis ajar logaritma rada bingung ngerjain tugas geografi numpuk kemarin god night rest wel,10/31/2021,0
yeogijeoju,Negatif,gk catetan besok ptm tagih njir,10/31/2021,0
nadland_,Positif,halow pagi nad ptm hihi daring ptm,10/31/2021,0
innertaekoo,Positif,ptm mingu selesai mingdep pj yey,10/31/2021,0
sevillaae,Negatif,besok ptm,10/31/2021,0
trisulis98,Positif,ortu suport ptm batas sat sekolah peran tua kalah sukses ptm batas,10/31/2021,0
